,Unnamed: 0,index,id,PublicRemarks_x,Bathroom,Bedrooms,Sqft,Price,Type_x,Address,Longitude,Latitude,PostalCode,Id,MlsNumber,PublicRemarks_y,Type_y,Amenities,ArchitecturalStyle,ConstructedDate,HeatingType,BuiltIn,Parking1,Parking2,OwnershipType,MaintenanceFee,TaxAmount,PreviousClosePrice,PreviousSaleDate,image_1,image_2,image_3,image_4,image_5,image_6,image_7,image_8,image_9,image_10,image_11,image_12,image_13,image_14,image_15,image_16,image_17,image_18,image_19,image_20,image_21,image_22,image_23,image_24,image_25,image_26,image_27,image_28,image_29,image_30,image_31,image_32,image_33,image_34,image_35,image_36,image_37,image_38,image_39,image_40
0,0,49,26728545,"The Eagle's Nest - Point Grey Panorama OCEAN AND CITY VIEWS on a large 73x207.4=15,140 sf lot. Renovate, or build your 10,000 sf dream home, or up to 15,140sf of Multiplex units. Current solid and very liveable 3,650sf home w/6 bedrooms plus den & 3 baths. Walk to OLPH & West Point Grey Academy, Trimble Park, Jericho Hill Community Centre & Pool, Jericho Beach, Pacific Spirit Park, West 10th Village shops, services, restaurants and transit. Queen Mary Elem., Lord Byng Sec., St. George´s & UBC all nearby. A true locational GEM awaiting your inspiration. (29597347)",3.0,6.0,3605,7680000,Single Family,"2516 COURTENAY STREET|Vancouver, British Columbia V6R3X3",-123.200762,49.264556,V6R3X3,26728545,R2868802,"The Eagle's Nest - Point Grey Panorama OCEAN AND CITY VIEWS on a large 73x207.4=15,140 sf lot. Renovate, or build your 10,000 sf dream home, or up to 15,140sf of Multiplex units. Current solid and very liveable 3,650sf home w/6 bedrooms plus den & 3 baths. Walk to OLPH & West Point Grey Academy, Trimble Park, Jericho Hill Community Centre & Pool, Jericho Beach, Pacific Spirit Park, West 10th Village shops, services, restaurants and transit. Queen Mary Elem., Lord Byng Sec., St. George´s & UBC all nearby. A true locational GEM awaiting your inspiration. (29597347)",House,N/A,2 Level,1929,(Natural gas),1929,Detached Garage,2,Freehold,N/A,"$25,609.80","$5,800,000",2021-11-10,https://cdn.realtor.ca/listing/TS638483737641970000/reb89/highres/2/R2868802_1.jpg,https://cdn.realtor.ca/listing/TS638483737641830000/reb89/highres/2/R2868802_2.jpg,https://cdn.realtor.ca/listing/TS638483737642070000/reb89/highres/2/R2868802_3.jpg,https://cdn.realtor.ca/listing/TS638483737643730000/reb89/highres/2/R2868802_4.jpg,https://cdn.realtor.ca/listing/TS638483737661470000/reb89/highres/2/R2868802_5.jpg,https://cdn.realtor.ca/listing/TS638483737643770000/reb89/highres/2/R2868802_6.jpg,https://cdn.realtor.ca/listing/TS638483737643730000/reb89/highres/2/R2868802_7.jpg,https://cdn.realtor.ca/listing/TS638483737642070000/reb89/highres/2/R2868802_8.jpg,https://cdn.realtor.ca/listing/TS638483737641730000/reb89/highres/2/R2868802_9.jpg,https://cdn.realtor.ca/listing/TS638483737641570000/reb89/highres/2/R2868802_10.jpg,https://cdn.realtor.ca/listing/TS638483737642030000/reb89/highres/2/R2868802_11.jpg,https://cdn.realtor.ca/listing/TS638483737641970000/reb89/highres/2/R2868802_12.jpg,https://cdn.realtor.ca/listing/TS638483737637770000/reb89/highres/2/R2868802_13.jpg,https://cdn.realtor.ca/listing/TS638483737642130000/reb89/highres/2/R2868802_14.jpg,https://cdn.realtor.ca/listing/TS638483737637770000/reb89/highres/2/R2868802_15.jpg,https://cdn.realtor.ca/listing/TS638483737641870000/reb89/highres/2/R2868802_16.jpg,https://cdn.realtor.ca/listing/TS638483737641670000/reb89/highres/2/R2868802_17.jpg,https://cdn.realtor.ca/listing/TS638483737661530000/reb89/highres/2/R2868802_18.jpg,https://cdn.realtor.ca/listing/TS638483737625200000/reb89/highres/2/R2868802_19.jpg,https://cdn.realtor.ca/listing/TS638483737596300000/reb89/highres/2/R2868802_20.jpg,https://cdn.realtor.ca/listing/TS638483737661470000/reb89/highres/2/R2868802_21.jpg,https://cdn.realtor.ca/listing/TS638483737644170000/reb89/highres/2/R2868802_22.jpg,https://cdn.realtor.ca/listing/TS638483737662130000/reb89/highres/2/R2868802_23.jpg,,,,,,,,,,,,,,,,,
1,1,48,27468031,"LUXURIOUS Brand NEW home in the well sought out Point Grey area. Close proximity to renowned private & public schools, Showcasing exceptional design with modern interiors. The main floor features 10ft ceiling of phenomenal spaces that capture natural light from all directions. Open plan with impressive living & dining areas, den, large kitchen with oversized island, wok kitchen, top of the line appliances, eating area and adjoining family room with custom entry wall unit. Sun drenched south facing garden. Upstairs floor features 11 ft vaulted ceiling, 4 bdrms & Stylish Master with large w/i closet and a spa-like ensuite. Lower level features Theatre, Wine Cellar with open bar, family room and large laundry room. Property also includes a 2 car garage and a 2 storey laneway housing unit. (30397972)",6.0,5.0,4782,7288000,Single Family,"4582 W 14TH AVENUE|Vancouver, British Columbia V6R2Y4",-123.211652,49.260366,V6R2Y4,27468031,R2929941,"LUXURIOUS Brand NEW home in the well sought out Point Grey area. Close proximity to renowned private & public schools, Showcasing exceptional design with modern interiors. The main floor features 10ft ceiling of phenomenal spaces that capture natural light from all directions. Open plan with impressive living & dining areas, den, large kitchen with oversized island, wok kitchen, top of the line appliances, eating area and adjoining family room with custom entry wall unit. Sun drenched south facing garden. Upstairs floor features 11 ft vaulted ceiling, 4 bdrms & Stylish Master with large w/i closet and a spa-like ensuite. Lower level features Theatre, Wine Cellar with open bar, family room and large laundry room. Property also includes a 2 car garage and a 2 storey laneway housing unit. (30397972)",House,N/A,2 Level,2024,"Heat Pump, Radiant heat",2024,Garage,3,Freehold,N/A,"$12,339.80","$2,750,000",2014-11-10,https://cdn.realtor.ca/listing/TS638628909340500000/reb89/highres/1/R2929941_1.jpg,https://cdn.realtor.ca/listing/TS638628909340500000/reb89/highres/1/R2929941_2.jpg,https://cdn.realtor.ca/listing/TS638628909340500000/reb89/highres/1/R2929941_3.jpg,https://cdn.realtor.ca/listing/TS638628909340500000/reb89/highres/1/R2929941_4.jpg,https://cdn.realtor.ca/listing/TS638628909340500000/reb89/highres/1/R2929941_5.jpg,https://cdn.realtor.ca/listing/TS638628909340500000/reb89/highres/1/R2929941_6.jpg,https://cdn.realtor.ca/listing/TS638628909340500000/reb89/highres/1/R2929941_7.jpg,https://cdn.realtor.ca/listing/TS638628909340500000/reb89/highres/1/R2929941_8.jpg,https://cdn.realtor.ca/listing/TS638628909340500000/reb89/highres/1/R2929941_9.jpg,https://cdn.realtor.ca/listing/TS638628909340500000/reb89/highres/1/R2929941_10.jpg,https://cdn.realtor.ca/listing/TS638628909340500000/reb89/highres/1/R2929941_11.jpg,https://cdn.realtor.ca/listing/TS638628909340500000/reb89/highres/1/R2929941_12.jpg,https://cdn.realtor.ca/listing/TS638628909340500000/reb89/highres/1/R2929941_13.jpg,https://cdn.realtor.ca/listing/TS638628909340500000/reb89/highres/1/R2929941_14.jpg,https://cdn.realtor.ca/listing/TS638628909340500000/reb89/highres/1/R2929941_15.jpg,https://cdn.realtor.ca/listing/TS638628909340500000/reb89/highres/1/R2929941_16.jpg,https://cdn.realtor.ca/listing/TS638628909340500000/reb89/highres/1/R2929941_17.jpg,https://cdn.realtor.ca/listing/TS638628909340500000/reb89/highres/1/R2929941_18.jpg,https://cdn.realtor.ca/listing/TS638628909340500000/reb89/highres/1/R2929941_19.jpg,https://cdn.realtor.ca/listing/TS638628909340500000/reb89/highres/1/R2929941_20.jpg,https://cdn.realtor.ca/listing/TS638628909340500000/reb89/highres/1/R2929941_21.jpg,https://cdn.realtor.ca/listing/TS638628909340500000/reb89/highres/1/R2929941_22.jpg,https://cdn.realtor.ca/listing/TS638628909340500000/reb89/highres/1/R2929941_23.jpg,https://cdn.realtor.ca/listing/TS638628909340500000/reb89/highres/1/R2929941_24.jpg,https://cdn.realtor.ca/listing/TS638628909340500000/reb89/highres/1/R2929941_25.jpg,https://cdn.realtor.ca/listing/TS638628909340500000/reb89/highres/1/R2929941_26.jpg,https://cdn.realtor.ca/listing/TS638628909340500000/reb89/highres/1/R2929941_27.jpg,https://cdn.realtor.ca/listing/TS638628909340500000/reb89/highres/1/R2929941_28.jpg,https://cdn.realtor.ca/listing/TS638628909340500000/reb89/highres/1/R2929941_29.jpg,https://cdn.realtor.ca/listing/TS638628909340500000/reb89/highres/1/R2929941_30.jpg,https://cdn.realtor.ca/listing/TS638628909340500000/reb89/highres/1/R2929941_31.jpg,https://cdn.realtor.ca/listing/TS638628909340500000/reb89/highres/1/R2929941_32.jpg,,,,,,,,
2,2,47,27058996,"ABSOLUTELY GORGEOUS ESTATE!! Magnificent custom-built home in most prestigious area of Point Grey. This house features 641 sq.ft of rooftop deck that offer you panoramic views of city, mountain & water. It has been constructed to the highest of building standards, with the lavish use of the best materials and supreme finishing to details. Open concept living & dinning space with extensive used hardwood floor thru-out & large gourmet kitchen with high-end cabinetry & high-performance Miele appliances. Upper floor master bedroom offers 4 generous ensuite bedrooms. Lower level offers huge recreation room with wet bar, home theater, sauna room, nanny room& gym room. 3 car garage & decent, fenced private yard. School catchment: Lord Byng Secondary & Queen Elizabeth Elementary. Call today!!! (29955174)",7.0,5.0,4140,7288000,Single Family,"3867 W 14TH AVENUE|Vancouver, British Columbia V6R2X1",-123.190003,49.260136,V6R2X1,27058996,R2896178,"ABSOLUTELY GORGEOUS ESTATE!! Magnificent custom-built home in most prestigious area of Point Grey. This house features 641 sq.ft of rooftop deck that offer you panoramic views of city, mountain & water. It has been constructed to the highest of building standards, with the lavish use of the best materials and supreme finishing to details. Open concept living & dinning space with extensive used hardwood floor thru-out & large gourmet kitchen with high-end cabinetry & high-performance Miele appliances. Upper floor master bedroom offers 4 generous ensuite bedrooms. Lower level offers huge recreation room with wet bar, home theater, sauna room, nanny room& gym room. 3 car garage & decent, fenced private yard. School catchment: Lord Byng Secondary & Queen Elizabeth Elementary. Call today!!! (29955174)",House,N/A,2 Level,2018,"(Natural gas), Radiant heat",2018,Garage,3,Freehold,N/A,"$25,848.10","$4,500,000",2017-05-09,https://cdn.realtor.ca/listing/TS638543383165630000/reb89/highres/8/R2896178_1.jpg,https://cdn.realtor.ca/listing/TS638543383273300000/reb89/highres/8/R2896178_2.jpg,https://cdn.realtor.ca/listing/TS638543383272970000/reb89/highres/8/R2896178_3.jpg,https://cdn.realtor.ca/listing/TS638543383273300000/reb89/highres/8/R2896178_4.jpg,https://cdn.realtor.ca/listing/TS638543383166670000/reb89/highres/8/R2896178_5.jpg,https://cdn.realtor.ca/listing/TS638543383272970000/reb89/highres/8/R2896178_6.jpg,https://cdn.realtor.ca/listing/TS638543383273130000/reb89/highres/8/R2896178_7.jpg,https://cdn.realtor.ca/listing/TS638543383273470000/reb89/highres/8/R2896178_8.jpg,https://cdn.realtor.ca/listing/TS638543383165630000/reb89/highres/8/R2896178_9.jpg,https://cdn.realtor.ca/listing/TS638543383166100000/reb89/highres/8/R2896178_10.jpg,https://cdn.realtor.ca/listing/TS638543383277600000/reb89/highres/8/R2896178_11.jpg,https://cdn.realtor.ca/listing/TS638543383165600000/reb89/highres/8/R2896178_12.jpg,https://cdn.realtor.ca/listing/TS638543383273000000/reb89/highres/8/R2896178_13.jpg,https://cdn.realtor.ca/listing/TS638543383273300000/reb89/highres/8/R2896178_14.jpg,https://cdn.realtor.ca/listing/TS638543383166570000/reb89/highres/8/R2896178_15.jpg,https://cdn.realtor.ca/listing/TS638543383273270000/reb89/highres/8/R2896178_16.jpg,https://cdn.realtor.ca/listing/TS638543383166230000/reb89/highres/8/R2896178_17.jpg,https://cdn.realtor.ca/listing/TS638543383165830000/reb89/highres/8/R2896178_18.jpg,https://cdn.realtor.ca/listing/TS638543383272970000/reb89/highres/8/R2896178_19.jpg,https://cdn.realtor.ca/listing/TS638543383166570000/reb89/highres/8/R2896178_20.jpg,https://cdn.realtor.ca/listing/TS638543383166300000/reb89/highres/8/R2896178_21.jpg,https://cdn.realtor.ca/listing/TS638543383273500000/reb89/highres/8/R2896178_22.jpg,https://cdn.realtor.ca/listing/TS638543383273130000/reb89/highres/8/R2896178_23.jpg,https://cdn.realtor.ca/listing/TS638543383273270000/reb89/highres/8/R2896178_24.jpg,https://cdn.realtor.ca/listing/TS638543383272970000/reb89/highres/8/R2896178_25.jpg,https://cdn.realtor.ca/listing/TS638543383277500000/reb89/highres/8/R2896178_26.jpg,https://cdn.realtor.ca/listing/TS638543383277500000/reb89/highres/8/R2896178_27.jpg,https://cdn.realtor.ca/listing/TS638543383277730000/reb89/highres/8/R2896178_28.jpg,https://cdn.realtor.ca/listing/TS638543383277800000/reb89/highres/8/R2896178_29.jpg,https://cdn.realtor.ca/listing/TS638543383277430000/reb89/highres/8/R2896178_30.jpg,https://cdn.realtor.ca/listing/TS638543383277770000/reb89/highres/8/R2896178_31.jpg,https://cdn.realtor.ca/listing/TS638543383277670000/reb89/highres/8/R2896178_32.jpg,https://cdn.realtor.ca/listing/TS638543383277530000/reb89/highres/8/R2896178_33.jpg,https://cdn.realtor.ca/listing/TS638543383273270000/reb89/highres/8/R2896178_34.jpg,https://cdn.realtor.ca/listing/TS638543383278330000/reb89/highres/8/R2896178_35.jpg,https://cdn.realtor.ca/listing/TS638543383277730000/reb89/highres/8/R2896178_36.jpg,https://cdn.realtor.ca/listing/TS638543383278330000/reb89/highres/8/R2896178_37.jpg,https://cdn.realtor.ca/listing/TS638543383273300000/reb89/highres/8/R2896178_38.jpg,https://cdn.realtor.ca/listing/TS638543383278370000/reb89/highres/8/R2896178_39.jpg,https://cdn.realtor.ca/listing/TS638543383278300000/reb89/highres/8/R2896178_40.jpg
3,3,46,27656787,"Corner lot with high investment return on the high side in Point Grey area. Enjoy panoramic ocean/mountains/city views when sitting in your living room. Architecturally designed and custom built this 4,398 square foot home features 3 ensuite bedrooms and a large lower level ideal for entertaining. 3 level radiant heat, central air-conditioning & HRV. Built in 1995 this home has been impeccably maintained. Irreplaceable 60 x 122 foot lot will bode well for future appreciation. This well designed & maintained home shows like new. Near to top rank public / private schools. Vacant for showing. Call today! (30601596)",7.0,5.0,4398,6690000,Single Family,"3808 W 13TH AVENUE|Vancouver, British Columbia V6R2S8",-123.188249,49.260563,V6R2S8,27656787,R2944809,"Corner lot with high investment return on the high side in Point Grey area. Enjoy panoramic ocean/mountains/city views when sitting in your living room. Architecturally designed and custom built this 4,398 square foot home features 3 ensuite bedrooms and a large lower level ideal for entertaining. 3 level radiant heat, central air-conditioning & HRV. Built in 1995 this home has been impeccably maintained. Irreplaceable 60 x 122 foot lot will bode well for future appreciation. This well designed & maintained home shows like new. Near to top rank public / private schools. Vacant for showing. Call today! (30601596)",House,N/A,2 Level,1995,"Hot Water, Radiant heat",1995,Garage,2,Freehold,N/A,"$18,338.77","$3,768,000",2010-01-17,https://www.realtor.ca/images/common/listingplaceholder-highres.jpg,,,,,,,,,,,,,,,,,,,,,,,,,,,,,,,,,,,,,,,
4,4,45,27551774,"Stunning Ocean, mountain and Downtown View Home in prestigious West Point Grey! This custom built home features luxurious and exquisite details, and is crafted by top designers and engineers. Featuring designer lighting, premium Miele appliances, Italian cabinetry with marble countertops, and 9.5-inch wood flooring, every detail exudes elegance. The custom walnut office and luxurious master suite offer unparalleled sophistication. The basement is an entertainer´s dream with a guest suite, home theater, wine cellar, bar, and gym. Equipped with HRV, air conditioning, and underfloor heating, this home ensures year-round comfort. Walking distance to top-ranked WPGA and Queen Mary Elementary, close to Lord Byng Secondary, UBC, golf course and beach. 2-5-10 builder warranty remains. Must see! (30488321)",5.0,4.0,4028,6680000,Single Family,"4577 W 5TH AVENUE|Vancouver, British Columbia V6R1S6",-123.211212,49.268381,V6R1S6,27551774,R2936547,"Stunning Ocean, mountain and Downtown View Home in prestigious West Point Grey! This custom built home features luxurious and exquisite details, and is crafted by top designers and engineers. Featuring designer lighting, premium Miele appliances, Italian cabinetry with marble countertops, and 9.5-inch wood flooring, every detail exudes elegance. The custom walnut office and luxurious master suite offer unparalleled sophistication. The basement is an entertainer´s dream with a guest suite, home theater, wine cellar, bar, and gym. Equipped with HRV, air conditioning, and underfloor heating, this home ensures year-round comfort. Walking distance to top-ranked WPGA and Queen Mary Elementary, close to Lord Byng Secondary, UBC, golf course and beach. 2-5-10 builder warranty remains. Must see! (30488321)",House,N/A,2 Level,2017,"Hot Water, Radiant heat",2017,Garage,3,Freehold,N/A,"$27,056.10","$2,650,000",2013-03-30,https://cdn.realtor.ca/listing/TS638666196999270000/reb89/highres/7/R2936547_1.jpg,https://cdn.realtor.ca/listing/TS638666197026600000/reb89/highres/7/R2936547_2.jpg,https://cdn.realtor.ca/listing/TS638666197006870000/reb89/highres/7/R2936547_3.jpg,https://cdn.realtor.ca/listing/TS638666196998330000/reb89/highres/7/R2936547_4.jpg,https://cdn.realtor.ca/listing/TS638666197005770000/reb89/highres/7/R2936547_5.jpg,https://cdn.realtor.ca/listing/TS638666197007700000/reb89/highres/7/R2936547_6.jpg,https://cdn.realtor.ca/listing/TS638666196998330000/reb89/highres/7/R2936547_7.jpg,https://cdn.realtor.ca/listing/TS638666196999000000/reb89/highres/7/R2936547_8.jpg,https://cdn.realtor.ca/listing/TS638666196999300000/reb89/highres/7/R2936547_9.jpg,https://cdn.realtor.ca/listing/TS638666197022000000/reb89/highres/7/R2936547_10.jpg,https://cdn.realtor.ca/listing/TS638666197051100000/reb89/highres/7/R2936547_11.jpg,https://cdn.realtor.ca/listing/TS638666197005800000/reb89/highres/7/R2936547_12.jpg,https://cdn.realtor.ca/listing/TS638666197000000000/reb89/highres/7/R2936547_13.jpg,https://cdn.realtor.ca/listing/TS638666197022000000/reb89/highres/7/R2936547_14.jpg,https://cdn.realtor.ca/listing/TS638666197013500000/reb89/highres/7/R2936547_15.jpg,https://cdn.realtor.ca/listing/TS638666197051270000/reb89/highres/7/R2936547_16.jpg,https://cdn.realtor.ca/listing/TS638666197027270000/reb89/highres/7/R2936547_17.jpg,https://cdn.realtor.ca/listing/TS638666197051200000/reb89/highres/7/R2936547_18.jpg,https://cdn.realtor.ca/listing/TS638666197026770000/reb89/highres/7/R2936547_19.jpg,https://cdn.realtor.ca/listing/TS638666197025000000/reb89/highres/7/R2936547_20.jpg,https://cdn.realtor.ca/listing/TS638666196999830000/reb89/highres/7/R2936547_21.jpg,https://cdn.realtor.ca/listing/TS638666197024030000/reb89/highres/7/R2936547_22.jpg,https://cdn.realtor.ca/listing/TS638666197005800000/reb89/highres/7/R2936547_23.jpg,https://cdn.realtor.ca/listing/TS638666197026630000/reb89/highres/7/R2936547_24.jpg,https://cdn.realtor.ca/listing/TS638666197026730000/reb89/highres/7/R2936547_25.jpg,https://cdn.realtor.ca/listing/TS638666197026470000/reb89/highres/7/R2936547_26.jpg,https://cdn.realtor.ca/listing/TS638666196998330000/reb89/highres/7/R2936547_27.jpg,https://cdn.realtor.ca/listing/TS638666197051230000/reb89/highres/7/R2936547_28.jpg,https://cdn.realtor.ca/listing/TS638666196999830000/reb89/highres/7/R2936547_29.jpg,https://cdn.realtor.ca/listing/TS638666197024070000/reb89/highres/7/R2936547_30.jpg,https://cdn.realtor.ca/listing/TS638666197024070000/reb89/highres/7/R2936547_31.jpg,https://cdn.realtor.ca/listing/TS638666196998330000/reb89/highres/7/R2936547_32.jpg,https://cdn.realtor.ca/listing/TS638666197026630000/reb89/highres/7/R2936547_33.jpg,https://cdn.realtor.ca/listing/TS638666197026730000/reb89/highres/7/R2936547_34.jpg,https://cdn.realtor.ca/listing/TS638666197006330000/reb89/highres/7/R2936547_35.jpg,https://cdn.realtor.ca/listing/TS638666197026370000/reb89/highres/7/R2936547_36.jpg,https://cdn.realtor.ca/listing/TS638666197047700000/reb89/highres/7/R2936547_37.jpg,https://cdn.realtor.ca/listing/TS638666197026970000/reb89/highres/7/R2936547_38.jpg,https://cdn.realtor.ca/listing/TS638666197026800000/reb89/highres/7/R2936547_39.jpg,https://cdn.realtor.ca/listing/TS638666197024070000/reb89/highres/7/R2936547_40.jpg
5,5,44,27101624,"Welcome to your dream home on the prestigious Point Grey. Enjoy breathtaking views of the ocean and mountains from your master bedroom and 477 sqft roof deck. Steps away to LORD BYNG, WEST POINT GREY ACADEMY & UBC. Close to Royal Yachts Club & Jericho beach. This beautiful home offer over 4253 sq.ft.5 bedrooms and 5.5 bathrooms, is showcasing impeccably high-end finishing's thru out, QUALITY is built into every detail, over height ceiling, hand painted celing and walls & hardwood floor thru out. European kitchen, & spice kitchen, HOME THEATRE, WINE CELLAR. beautiful landscaping, HRV, A/C and much more. Must see! Open house Nov 9 Sat 2-4 Pm (30001527)",6.0,5.0,4253,6580000,Single Family,"3963 W 11TH AVENUE|Vancouver, British Columbia V6R2L1",-123.192026,49.262534,V6R2L1,27101624,R2899903,"Welcome to your dream home on the prestigious Point Grey. Enjoy breathtaking views of the ocean and mountains from your master bedroom and 477 sqft roof deck. Steps away to LORD BYNG, WEST POINT GREY ACADEMY & UBC. Close to Royal Yachts Club & Jericho beach. This beautiful home offer over 4253 sq.ft.5 bedrooms and 5.5 bathrooms, is showcasing impeccably high-end finishing's thru out, QUALITY is built into every detail, over height ceiling, hand painted celing and walls & hardwood floor thru out. European kitchen, & spice kitchen, HOME THEATRE, WINE CELLAR. beautiful landscaping, HRV, A/C and much more. Must see! Open house Nov 9 Sat 2-4 Pm (30001527)",House,N/A,2 Level,2014,Radiant heat,2014,Garage,3,Freehold,N/A,"$27,839.55","$2,360,000",2010-04-29,https://cdn.realtor.ca/listing/TS638551303146270000/reb89/highres/3/R2899903_1.jpg,https://cdn.realtor.ca/listing/TS638551303157970000/reb89/highres/3/R2899903_2.jpg,https://cdn.realtor.ca/listing/TS638551303146300000/reb89/highres/3/R2899903_3.jpg,https://cdn.realtor.ca/listing/TS638551303128300000/reb89/highres/3/R2899903_4.jpg,https://cdn.realtor.ca/listing/TS638551303152800000/reb89/highres/3/R2899903_5.jpg,https://cdn.realtor.ca/listing/TS638551303124330000/reb89/highres/3/R2899903_6.jpg,https://cdn.realtor.ca/listing/TS638551303130500000/reb89/highres/3/R2899903_7.jpg,https://cdn.realtor.ca/listing/TS638551303128300000/reb89/highres/3/R2899903_8.jpg,https://cdn.realtor.ca/listing/TS638551303182500000/reb89/highres/3/R2899903_9.jpg,https://cdn.realtor.ca/listing/TS638551303116030000/reb89/highres/3/R2899903_10.jpg,https://cdn.realtor.ca/listing/TS638551303123770000/reb89/highres/3/R2899903_11.jpg,https://cdn.realtor.ca/listing/TS638551303116030000/reb89/highres/3/R2899903_12.jpg,https://cdn.realtor.ca/listing/TS638551303123730000/reb89/highres/3/R2899903_13.jpg,https://cdn.realtor.ca/listing/TS638551303116070000/reb89/highres/3/R2899903_14.jpg,https://cdn.realtor.ca/listing/TS638551303134570000/reb89/highres/3/R2899903_15.jpg,https://cdn.realtor.ca/listing/TS638551303134570000/reb89/highres/3/R2899903_16.jpg,https://cdn.realtor.ca/listing/TS638551303116030000/reb89/highres/3/R2899903_17.jpg,https://cdn.realtor.ca/listing/TS638551303116070000/reb89/highres/3/R2899903_18.jpg,https://cdn.realtor.ca/listing/TS638551303116070000/reb89/highres/3/R2899903_19.jpg,https://cdn.realtor.ca/listing/TS638551303111900000/reb89/highres/3/R2899903_20.jpg,https://cdn.realtor.ca/listing/TS638551303139500000/reb89/highres/3/R2899903_21.jpg,https://cdn.realtor.ca/listing/TS638551303157430000/reb89/highres/3/R2899903_22.jpg,https://cdn.realtor.ca/listing/TS638551303136230000/reb89/highres/3/R2899903_23.jpg,https://cdn.realtor.ca/listing/TS638551303116870000/reb89/highres/3/R2899903_24.jpg,https://cdn.realtor.ca/listing/TS638551303158070000/reb89/highres/3/R2899903_25.jpg,https://cdn.realtor.ca/listing/TS638551303141200000/reb89/highres/3/R2899903_26.jpg,https://cdn.realtor.ca/listing/TS638551303141470000/reb89/highres/3/R2899903_27.jpg,https://cdn.realtor.ca/listing/TS638551303134170000/reb89/highres/3/R2899903_28.jpg,https://cdn.realtor.ca/listing/TS638551303157200000/reb89/highres/3/R2899903_29.jpg,https://cdn.realtor.ca/listing/TS638551303158070000/reb89/highres/3/R2899903_30.jpg,https://cdn.realtor.ca/listing/TS638551303134200000/reb89/highres/3/R2899903_31.jpg,https://cdn.realtor.ca/listing/TS638551303141800000/reb89/highres/3/R2899903_32.jpg,https://cdn.realtor.ca/listing/TS638551303130670000/reb89/highres/3/R2899903_33.jpg,https://cdn.realtor.ca/listing/TS638551303129200000/reb89/highres/3/R2899903_34.jpg,https://cdn.realtor.ca/listing/TS638551303148230000/reb89/highres/3/R2899903_35.jpg,https://cdn.realtor.ca/listing/TS638551303158100000/reb89/highres/3/R2899903_36.jpg,https://cdn.realtor.ca/listing/TS638551303130830000/reb89/highres/3/R2899903_37.jpg,https://cdn.realtor.ca/listing/TS638551303116070000/reb89/highres/3/R2899903_38.jpg,https://cdn.realtor.ca/listing/TS638551303139500000/reb89/highres/3/R2899903_39.jpg,https://cdn.realtor.ca/listing/TS638551303142230000/reb89/highres/3/R2899903_40.jpg
