,Unnamed: 0,index,id,PublicRemarks_x,Bathroom,Bedrooms,Sqft,Price,Type_x,Address,Longitude,Latitude,PostalCode,Id,MlsNumber,PublicRemarks_y,Type_y,Amenities,ArchitecturalStyle,ConstructedDate,HeatingType,BuiltIn,Parking1,Parking2,OwnershipType,MaintenanceFee,TaxAmount,PreviousClosePrice,PreviousSaleDate,image_1,image_2,image_3,image_4,image_5,image_6,image_7,image_8,image_9,image_10,image_11,image_12,image_13,image_14,image_15,image_16,image_17,image_18,image_19,image_20,image_21,image_22,image_23,image_24,image_25,image_26,image_27,image_28,image_29,image_30,image_31,image_32,image_33,image_34,image_35,image_36,image_37,image_38,image_39,image_40
19,19,30,27421899,"A rare opportunity to own a beautiful family home in one of Vancouver's most sought after locations! This traditional style home faces the ocean with a mountain backdrop in the distance. Featuring a front to back living room with a wood burning fireplace, renovated, spacious kitchen with a central island and a large south facing deck. Highlighted by solid oak hardwood floors and leaded glass French doors. With 4 bedrooms up and potential to develop the lower level further. Don´t miss your chance at this quiet yet central and family focused neighbourhood with top catchment public schools Queen Mary & Lord Byng and No.1 private schools WPGA and OLPH. Find yourself steps away from Pacific Spirit Park & Jericho Beach as well as many shops, restaurants and amenities! (30347886)",2.0,5.0,3208,4298000,Single Family,"4086 W 8TH AVENUE|Vancouver, British Columbia V6R1Z6",-123.196325,49.265161,V6R1Z6,27421899,R2925987,"A rare opportunity to own a beautiful family home in one of Vancouver's most sought after locations! This traditional style home faces the ocean with a mountain backdrop in the distance. Featuring a front to back living room with a wood burning fireplace, renovated, spacious kitchen with a central island and a large south facing deck. Highlighted by solid oak hardwood floors and leaded glass French doors. With 4 bedrooms up and potential to develop the lower level further. Don´t miss your chance at this quiet yet central and family focused neighbourhood with top catchment public schools Queen Mary & Lord Byng and No.1 private schools WPGA and OLPH. Find yourself steps away from Pacific Spirit Park & Jericho Beach as well as many shops, restaurants and amenities! (30347886)",House,N/A,2 Level,1931,"Forced air, (Natural gas)",1931,Garage,3,Freehold,N/A,"$25,723.70","$1,889,000",2006-07-07,https://cdn.realtor.ca/listing/TS638621060645770000/reb89/highres/7/R2925987_1.jpg,https://cdn.realtor.ca/listing/TS638621060645770000/reb89/highres/7/R2925987_2.jpg,https://cdn.realtor.ca/listing/TS638621060645770000/reb89/highres/7/R2925987_3.jpg,https://cdn.realtor.ca/listing/TS638621060645770000/reb89/highres/7/R2925987_4.jpg,https://cdn.realtor.ca/listing/TS638621060645770000/reb89/highres/7/R2925987_5.jpg,https://cdn.realtor.ca/listing/TS638621060645770000/reb89/highres/7/R2925987_6.jpg,https://cdn.realtor.ca/listing/TS638621060645770000/reb89/highres/7/R2925987_7.jpg,https://cdn.realtor.ca/listing/TS638621060645770000/reb89/highres/7/R2925987_8.jpg,https://cdn.realtor.ca/listing/TS638621060645770000/reb89/highres/7/R2925987_9.jpg,https://cdn.realtor.ca/listing/TS638621060645770000/reb89/highres/7/R2925987_10.jpg,https://cdn.realtor.ca/listing/TS638621060645770000/reb89/highres/7/R2925987_11.jpg,https://cdn.realtor.ca/listing/TS638621060645770000/reb89/highres/7/R2925987_12.jpg,https://cdn.realtor.ca/listing/TS638621060645770000/reb89/highres/7/R2925987_13.jpg,https://cdn.realtor.ca/listing/TS638621060645770000/reb89/highres/7/R2925987_14.jpg,https://cdn.realtor.ca/listing/TS638621060645770000/reb89/highres/7/R2925987_15.jpg,https://cdn.realtor.ca/listing/TS638621060645770000/reb89/highres/7/R2925987_16.jpg,https://cdn.realtor.ca/listing/TS638621060645770000/reb89/highres/7/R2925987_17.jpg,https://cdn.realtor.ca/listing/TS638621060645770000/reb89/highres/7/R2925987_18.jpg,https://cdn.realtor.ca/listing/TS638621060645770000/reb89/highres/7/R2925987_19.jpg,https://cdn.realtor.ca/listing/TS638621060645770000/reb89/highres/7/R2925987_20.jpg,https://cdn.realtor.ca/listing/TS638621060645770000/reb89/highres/7/R2925987_21.jpg,https://cdn.realtor.ca/listing/TS638621060645770000/reb89/highres/7/R2925987_22.jpg,https://cdn.realtor.ca/listing/TS638621060645770000/reb89/highres/7/R2925987_23.jpg,https://cdn.realtor.ca/listing/TS638621060645770000/reb89/highres/7/R2925987_24.jpg,https://cdn.realtor.ca/listing/TS638621060645770000/reb89/highres/7/R2925987_25.jpg,https://cdn.realtor.ca/listing/TS638621060645770000/reb89/highres/7/R2925987_26.jpg,https://cdn.realtor.ca/listing/TS638621060645770000/reb89/highres/7/R2925987_27.jpg,,,,,,,,,,,,,
20,20,29,27432255,"Beautiful Georgian Revival Estate home in the Prestige Point Grey! This Spacious 6 bed 2.5bath 3504SF family home has been well taken care of. Main floor boasts Grand foyer, Cozy living room w/Original hardwood floor, Formal dining room leads to a Bright kitchen, family room with skylights. Bedroom/Office with French door access to the back patio. Upstairs has 4 large bedrooms and a full bath. Partially finished basement has a guest bedroom, full bath, entertainment room, laundry room, separate entrance.  Mature landscaping and Well maintained Garden. Single garage. This 55x122 south facing lot has no big tree on property. Mountain view & Peek-a-boo water view from upper floor.  Close to WPGA, Walk to Jericho Beach, easy access to Broadway shopping & UBC! (30358841)",3.0,6.0,3504,4200000,Single Family,"4132 CROWN CRESCENT|Vancouver, British Columbia V6R2A9",-123.197669,49.264323,V6R2A9,,,,,,,,,,,,,,,,,,,,,,,,,,,,,,,,,,,,,,,,,,,,,,,,,,,,,,,,
21,21,28,26759296,"Location! Location! West Point Grey. Great school catchments. (Queen Mary Elementary School & Lord Byng Secondary School) Few Mins to UBC, close to future Skytrain station. Near bus route, i.e . direct bus route to UBC and downtown. walking distance to banks, restaurants and shops. Lot size: 36.70 x 112.70 3 car garage. Spacious 3 bedrooms with studio in basement. Well kept property. (29630556)",4.0,3.0,2502,3990000,Single Family,"4633 W 7TH AVENUE|Vancouver, British Columbia V6R1X4",-123.213211,49.266754,V6R1X4,26759296,R2871260,"Location! Location! West Point Grey. Great school catchments. (Queen Mary Elementary School & Lord Byng Secondary School) Few Mins to UBC, close to future Skytrain station. Near bus route, i.e . direct bus route to UBC and downtown. walking distance to banks, restaurants and shops. Lot size: 36.70 x 112.70 3 car garage. Spacious 3 bedrooms with studio in basement. Well kept property. (29630556)",House,N/A,2 Level,2007,"(Combination), (Natural gas), Radiant heat",2007,Garage,3,Freehold,N/A,"$12,192.90","$542,280",1996-12-02,https://cdn.realtor.ca/listing/TS638489804228100000/reb89/highres/0/R2871260_1.jpg,https://cdn.realtor.ca/listing/TS638489804204830000/reb89/highres/0/R2871260_2.jpg,https://cdn.realtor.ca/listing/TS638489804227670000/reb89/highres/0/R2871260_3.jpg,https://cdn.realtor.ca/listing/TS638489804215800000/reb89/highres/0/R2871260_4.jpg,https://cdn.realtor.ca/listing/TS638489804215800000/reb89/highres/0/R2871260_5.jpg,https://cdn.realtor.ca/listing/TS638489804227630000/reb89/highres/0/R2871260_6.jpg,https://cdn.realtor.ca/listing/TS638489804198600000/reb89/highres/0/R2871260_7.jpg,https://cdn.realtor.ca/listing/TS638489804222570000/reb89/highres/0/R2871260_8.jpg,https://cdn.realtor.ca/listing/TS638489804223300000/reb89/highres/0/R2871260_9.jpg,https://cdn.realtor.ca/listing/TS638489804203230000/reb89/highres/0/R2871260_10.jpg,https://cdn.realtor.ca/listing/TS638489804205030000/reb89/highres/0/R2871260_11.jpg,https://cdn.realtor.ca/listing/TS638489804199300000/reb89/highres/0/R2871260_12.jpg,https://cdn.realtor.ca/listing/TS638489804218130000/reb89/highres/0/R2871260_13.jpg,https://cdn.realtor.ca/listing/TS638489804227600000/reb89/highres/0/R2871260_14.jpg,https://cdn.realtor.ca/listing/TS638489804215800000/reb89/highres/0/R2871260_15.jpg,https://cdn.realtor.ca/listing/TS638489804240330000/reb89/highres/0/R2871260_16.jpg,https://cdn.realtor.ca/listing/TS638489804227600000/reb89/highres/0/R2871260_17.jpg,https://cdn.realtor.ca/listing/TS638489804227800000/reb89/highres/0/R2871260_18.jpg,https://cdn.realtor.ca/listing/TS638489804227430000/reb89/highres/0/R2871260_19.jpg,https://cdn.realtor.ca/listing/TS638489804205130000/reb89/highres/0/R2871260_20.jpg,https://cdn.realtor.ca/listing/TS638489804240470000/reb89/highres/0/R2871260_21.jpg,https://cdn.realtor.ca/listing/TS638489804223970000/reb89/highres/0/R2871260_22.jpg,https://cdn.realtor.ca/listing/TS638489804222570000/reb89/highres/0/R2871260_23.jpg,https://cdn.realtor.ca/listing/TS638489804194130000/reb89/highres/0/R2871260_24.jpg,https://cdn.realtor.ca/listing/TS638489804194130000/reb89/highres/0/R2871260_25.jpg,https://cdn.realtor.ca/listing/TS638489804228530000/reb89/highres/0/R2871260_26.jpg,https://cdn.realtor.ca/listing/TS638489804200000000/reb89/highres/0/R2871260_27.jpg,https://cdn.realtor.ca/listing/TS638489804218170000/reb89/highres/0/R2871260_28.jpg,https://cdn.realtor.ca/listing/TS638489804197200000/reb89/highres/0/R2871260_29.jpg,https://cdn.realtor.ca/listing/TS638489804228000000/reb89/highres/0/R2871260_30.jpg,https://cdn.realtor.ca/listing/TS638489804197200000/reb89/highres/0/R2871260_31.jpg,https://cdn.realtor.ca/listing/TS638489804227170000/reb89/highres/0/R2871260_32.jpg,https://cdn.realtor.ca/listing/TS638489804203900000/reb89/highres/0/R2871260_33.jpg,https://cdn.realtor.ca/listing/TS638489804215800000/reb89/highres/0/R2871260_34.jpg,https://cdn.realtor.ca/listing/TS638489804227930000/reb89/highres/0/R2871260_35.jpg,,,,,
22,22,27,27434254,"**Charming West Point Grey Home with Upgrades!**Discover this classic residence on a spacious 46 x 122 lot, featuring 5 bedroom + office and 3 full bathrooms, Lennox high efficiency furnace and air conditioner (purposely oversized for a future, larger house), On demand water heater, Renovated kitchen and main floor bathroom, Columbia wooden kitchen cabinets, Ultra high quality Marvin double hung windows (aluminum exterior/wood interior) (main and upper floors), Inlay heritage hardwood floor on main and restored heritage fir floor upstairs, Three large and easily access attics.++ A 2 bedrooms / 925 sqft LANEWAY HOUSE Designed by award-winning architect Alexandre Ravkov and much more! Must see!++ (30361272)",5.0,7.0,3242,3898000,Single Family,"4671 W 13TH AVENUE|Vancouver, British Columbia V6R2V6",-123.214278,49.261403,V6R2V6,27434254,R2927018,"**Charming West Point Grey Home with Upgrades!**Discover this classic residence on a spacious 46 x 122 lot, featuring 5 bedroom + office and 3 full bathrooms, Lennox high efficiency furnace and air conditioner (purposely oversized for a future, larger house), On demand water heater, Renovated kitchen and main floor bathroom, Columbia wooden kitchen cabinets, Ultra high quality Marvin double hung windows (aluminum exterior/wood interior) (main and upper floors), Inlay heritage hardwood floor on main and restored heritage fir floor upstairs, Three large and easily access attics.++ A 2 bedrooms / 925 sqft LANEWAY HOUSE Designed by award-winning architect Alexandre Ravkov and much more! Must see!++ (30361272)",House,N/A,2 Level,1939,"Forced air, (Natural gas)",1939,Garage,2,Freehold,N/A,"$12,334.90","$1,470,808",2007-07-15,https://cdn.realtor.ca/listing/TS638623568304330000/reb89/highres/8/R2927018_1.jpg,https://cdn.realtor.ca/listing/TS638623568284730000/reb89/highres/8/R2927018_2.jpg,https://cdn.realtor.ca/listing/TS638623568303770000/reb89/highres/8/R2927018_3.jpg,https://cdn.realtor.ca/listing/TS638623568284770000/reb89/highres/8/R2927018_4.jpg,https://cdn.realtor.ca/listing/TS638623568285070000/reb89/highres/8/R2927018_5.jpg,https://cdn.realtor.ca/listing/TS638623568303870000/reb89/highres/8/R2927018_6.jpg,https://cdn.realtor.ca/listing/TS638623568300170000/reb89/highres/8/R2927018_7.jpg,https://cdn.realtor.ca/listing/TS638623568284770000/reb89/highres/8/R2927018_8.jpg,https://cdn.realtor.ca/listing/TS638623568284800000/reb89/highres/8/R2927018_9.jpg,https://cdn.realtor.ca/listing/TS638623568284930000/reb89/highres/8/R2927018_10.jpg,https://cdn.realtor.ca/listing/TS638623568303670000/reb89/highres/8/R2927018_11.jpg,https://cdn.realtor.ca/listing/TS638623568300100000/reb89/highres/8/R2927018_12.jpg,https://cdn.realtor.ca/listing/TS638623568284770000/reb89/highres/8/R2927018_13.jpg,https://cdn.realtor.ca/listing/TS638623568303500000/reb89/highres/8/R2927018_14.jpg,https://cdn.realtor.ca/listing/TS638623568303670000/reb89/highres/8/R2927018_15.jpg,https://cdn.realtor.ca/listing/TS638623568303670000/reb89/highres/8/R2927018_16.jpg,https://cdn.realtor.ca/listing/TS638623568303430000/reb89/highres/8/R2927018_17.jpg,https://cdn.realtor.ca/listing/TS638623568300270000/reb89/highres/8/R2927018_18.jpg,https://cdn.realtor.ca/listing/TS638623568285000000/reb89/highres/8/R2927018_19.jpg,https://cdn.realtor.ca/listing/TS638623568299770000/reb89/highres/8/R2927018_20.jpg,https://cdn.realtor.ca/listing/TS638623568303730000/reb89/highres/8/R2927018_21.jpg,https://cdn.realtor.ca/listing/TS638623568284930000/reb89/highres/8/R2927018_22.jpg,https://cdn.realtor.ca/listing/TS638623568300000000/reb89/highres/8/R2927018_23.jpg,https://cdn.realtor.ca/listing/TS638623568284500000/reb89/highres/8/R2927018_24.jpg,https://cdn.realtor.ca/listing/TS638623568304370000/reb89/highres/8/R2927018_25.jpg,https://cdn.realtor.ca/listing/TS638623568300670000/reb89/highres/8/R2927018_26.jpg,https://cdn.realtor.ca/listing/TS638623568300200000/reb89/highres/8/R2927018_27.jpg,https://cdn.realtor.ca/listing/TS638623568300070000/reb89/highres/8/R2927018_28.jpg,https://cdn.realtor.ca/listing/TS638623568300670000/reb89/highres/8/R2927018_29.jpg,https://cdn.realtor.ca/listing/TS638623568304330000/reb89/highres/8/R2927018_30.jpg,https://cdn.realtor.ca/listing/TS638623568304000000/reb89/highres/8/R2927018_31.jpg,https://cdn.realtor.ca/listing/TS638623568303970000/reb89/highres/8/R2927018_32.jpg,https://cdn.realtor.ca/listing/TS638623568300630000/reb89/highres/8/R2927018_33.jpg,https://cdn.realtor.ca/listing/TS638623568300000000/reb89/highres/8/R2927018_34.jpg,https://cdn.realtor.ca/listing/TS638623568300130000/reb89/highres/8/R2927018_35.jpg,https://cdn.realtor.ca/listing/TS638623568303930000/reb89/highres/8/R2927018_36.jpg,https://cdn.realtor.ca/listing/TS638623568304330000/reb89/highres/8/R2927018_37.jpg,https://cdn.realtor.ca/listing/TS638623568262470000/reb89/highres/8/R2927018_38.jpg,https://cdn.realtor.ca/listing/TS638623568284800000/reb89/highres/8/R2927018_39.jpg,https://cdn.realtor.ca/listing/TS638623568285070000/reb89/highres/8/R2927018_40.jpg
23,23,26,27508102,"Spectacular Point Grey residence in quite street. 3 bedroom-plus-den 1930's home, renovated in 2016 maintaining the character and style of the 30's.  Full-height unfinished basement with separate entrance to the garden which can be converted to a second suite. Steps to transit for UBC & Downtown, two blocks to Jericho Sailing Centre, Aberthau, Brock House, Jericho Gym, West Point Grey Academy, Queen Mary School, Jericho Park, Locarno Beach, Spanish Banks; Lord Byng catchment area. Investors Alert, it is a perfect investment either to hold or build. Functional Floor Plans. Open House 11/9 Sat 2-4pm (30441170)",2.0,3.0,2864,3890000,Single Family,"4309 LOCARNO CRESCENT|Vancouver, British Columbia V6R1G2",-123.203416,49.269019,V6R1G2,27508102,R2933068,"Spectacular Point Grey residence in quite street. 3 bedroom-plus-den 1930's home, renovated in 2016 maintaining the character and style of the 30's.  Full-height unfinished basement with separate entrance to the garden which can be converted to a second suite. Steps to transit for UBC & Downtown, two blocks to Jericho Sailing Centre, Aberthau, Brock House, Jericho Gym, West Point Grey Academy, Queen Mary School, Jericho Park, Locarno Beach, Spanish Banks; Lord Byng catchment area. Investors Alert, it is a perfect investment either to hold or build. Functional Floor Plans. Open House 11/9 Sat 2-4pm (30441170)",House,N/A,2 Level,1930,"Forced air, (Natural gas)",1930,Garage,3,Freehold,N/A,"$16,834","$3,257,000",2015-09-28,https://cdn.realtor.ca/listing/TS638644176756470000/reb89/highres/8/R2933068_1.jpg,https://cdn.realtor.ca/listing/TS638644176756800000/reb89/highres/8/R2933068_2.jpg,https://cdn.realtor.ca/listing/TS638644176756900000/reb89/highres/8/R2933068_3.jpg,https://cdn.realtor.ca/listing/TS638644176756730000/reb89/highres/8/R2933068_4.jpg,https://cdn.realtor.ca/listing/TS638644176756270000/reb89/highres/8/R2933068_5.jpg,https://cdn.realtor.ca/listing/TS638644176756570000/reb89/highres/8/R2933068_6.jpg,https://cdn.realtor.ca/listing/TS638644176741730000/reb89/highres/8/R2933068_7.jpg,https://cdn.realtor.ca/listing/TS638644176756900000/reb89/highres/8/R2933068_8.jpg,https://cdn.realtor.ca/listing/TS638644176757200000/reb89/highres/8/R2933068_9.jpg,https://cdn.realtor.ca/listing/TS638644176759370000/reb89/highres/8/R2933068_10.jpg,https://cdn.realtor.ca/listing/TS638644176740400000/reb89/highres/8/R2933068_11.jpg,https://cdn.realtor.ca/listing/TS638644176756800000/reb89/highres/8/R2933068_12.jpg,https://cdn.realtor.ca/listing/TS638644176669600000/reb89/highres/8/R2933068_13.jpg,https://cdn.realtor.ca/listing/TS638644176756330000/reb89/highres/8/R2933068_14.jpg,https://cdn.realtor.ca/listing/TS638644176742100000/reb89/highres/8/R2933068_15.jpg,https://cdn.realtor.ca/listing/TS638644176741100000/reb89/highres/8/R2933068_16.jpg,https://cdn.realtor.ca/listing/TS638644176740570000/reb89/highres/8/R2933068_17.jpg,https://cdn.realtor.ca/listing/TS638644176756400000/reb89/highres/8/R2933068_18.jpg,https://cdn.realtor.ca/listing/TS638644176663800000/reb89/highres/8/R2933068_19.jpg,https://cdn.realtor.ca/listing/TS638644176741030000/reb89/highres/8/R2933068_20.jpg,https://cdn.realtor.ca/listing/TS638644176740400000/reb89/highres/8/R2933068_21.jpg,https://cdn.realtor.ca/listing/TS638644176664000000/reb89/highres/8/R2933068_22.jpg,https://cdn.realtor.ca/listing/TS638644176657230000/reb89/highres/8/R2933068_23.jpg,https://cdn.realtor.ca/listing/TS638644176756500000/reb89/highres/8/R2933068_24.jpg,https://cdn.realtor.ca/listing/TS638644176756500000/reb89/highres/8/R2933068_25.jpg,https://cdn.realtor.ca/listing/TS638644176740530000/reb89/highres/8/R2933068_26.jpg,https://cdn.realtor.ca/listing/TS638644176756570000/reb89/highres/8/R2933068_27.jpg,https://cdn.realtor.ca/listing/TS638644176756500000/reb89/highres/8/R2933068_28.jpg,https://cdn.realtor.ca/listing/TS638644176742070000/reb89/highres/8/R2933068_29.jpg,https://cdn.realtor.ca/listing/TS638644176756430000/reb89/highres/8/R2933068_30.jpg,https://cdn.realtor.ca/listing/TS638644176741600000/reb89/highres/8/R2933068_31.jpg,https://cdn.realtor.ca/listing/TS638644176740400000/reb89/highres/8/R2933068_32.jpg,https://cdn.realtor.ca/listing/TS638644176740570000/reb89/highres/8/R2933068_33.jpg,https://cdn.realtor.ca/listing/TS638644176740430000/reb89/highres/8/R2933068_34.jpg,https://cdn.realtor.ca/listing/TS638644176740470000/reb89/highres/8/R2933068_35.jpg,https://cdn.realtor.ca/listing/TS638644176759030000/reb89/highres/8/R2933068_36.jpg,https://cdn.realtor.ca/listing/TS638644176741100000/reb89/highres/8/R2933068_37.jpg,https://cdn.realtor.ca/listing/TS638644176741630000/reb89/highres/8/R2933068_38.jpg,https://cdn.realtor.ca/listing/TS638644176758630000/reb89/highres/8/R2933068_39.jpg,https://cdn.realtor.ca/listing/TS638644176759070000/reb89/highres/8/R2933068_40.jpg
24,24,25,27402447,"Nestled in the heart of Vancouver's prestigious West Point Grey, this serene home blends elegance and comfort reminiscent of a Mediterranean villa. Boasting 5 bright bedrooms, 2 kitchens with multi-functional floor plans and a landscaped garden, this renovated and move in ready 2458 sf sanctuary is ideal for families and entertaining. This home commands breathtaking water, city, and mountain views with an expansive south-facing backyard, complete with a greenhouse and a shed, beckons gardening enthusiasts. Picture tranquil mornings savouring coffee in the terra-cotta kitchen, Sunday afternoons relaxing in the garden, and a peaceful evening unwinding in the ocean view jacuzzi. Walking distance to the best catchment school in Vancouver West - Lord Byng Secondary and QE Elementary. (30326994)",5.0,5.0,2458,3860000,Single Family,"3888 W 13TH AVENUE|Vancouver, British Columbia V6R2S8",-123.189786,49.260619,V6R2S8,,,,,,,,,,,,,,,,,,,,,,,,,,,,,,,,,,,,,,,,,,,,,,,,,,,,,,,,
25,25,24,27563507,"Prime Point Grey location. Well maintained older character home with views on both main and upper floor towards Burrard Inlet, North Shore Mountains & Downtown Vancouver. Perfect to hold or renovate or build a brand new VIEW home. Existing home has two bedrooms and a full bathroom upstairs. Basement is walkout with decent ceiling height. Surrounded by top schools, close to Lord Byng Secondary, Queen Elizabeth Elementary, WPGA, OLPH. Short drive to St. George's School, Crofton House School and UBC. (30500680)",3.0,2.0,1933,3558000,Single Family,"3981 W 11TH AVENUE|Vancouver, British Columbia V6R2L1",-123.192784,49.263004,V6R2L1,27563507,R2937173,"Prime Point Grey location. Well maintained older character home with views on both main and upper floor towards Burrard Inlet, North Shore Mountains & Downtown Vancouver. Perfect to hold or renovate or build a brand new VIEW home. Existing home has two bedrooms and a full bathroom upstairs. Basement is walkout with decent ceiling height. Surrounded by top schools, close to Lord Byng Secondary, Queen Elizabeth Elementary, WPGA, OLPH. Short drive to St. George's School, Crofton House School and UBC. (30500680)",House,N/A,2 Level,1920,"(Electric), (Natural gas)",1920,Detached Garage,1,Freehold,N/A,"$13,117.30","$2,798,000",2020-02-02,https://cdn.realtor.ca/listing/TS638651341550630000/reb89/highres/3/R2937173_1.jpg,https://cdn.realtor.ca/listing/TS638651341537000000/reb89/highres/3/R2937173_2.jpg,https://cdn.realtor.ca/listing/TS638651341544200000/reb89/highres/3/R2937173_3.jpg,https://cdn.realtor.ca/listing/TS638651341544470000/reb89/highres/3/R2937173_4.jpg,https://cdn.realtor.ca/listing/TS638651341537200000/reb89/highres/3/R2937173_5.jpg,https://cdn.realtor.ca/listing/TS638651341544200000/reb89/highres/3/R2937173_6.jpg,https://cdn.realtor.ca/listing/TS638651341544200000/reb89/highres/3/R2937173_7.jpg,https://cdn.realtor.ca/listing/TS638651341537200000/reb89/highres/3/R2937173_8.jpg,https://cdn.realtor.ca/listing/TS638651341537200000/reb89/highres/3/R2937173_9.jpg,https://cdn.realtor.ca/listing/TS638651341447970000/reb89/highres/3/R2937173_10.jpg,https://cdn.realtor.ca/listing/TS638651341544070000/reb89/highres/3/R2937173_11.jpg,https://cdn.realtor.ca/listing/TS638651341545130000/reb89/highres/3/R2937173_12.jpg,https://cdn.realtor.ca/listing/TS638651341544600000/reb89/highres/3/R2937173_13.jpg,https://cdn.realtor.ca/listing/TS638651341447970000/reb89/highres/3/R2937173_14.jpg,https://cdn.realtor.ca/listing/TS638651341545130000/reb89/highres/3/R2937173_15.jpg,https://cdn.realtor.ca/listing/TS638651341544470000/reb89/highres/3/R2937173_16.jpg,https://cdn.realtor.ca/listing/TS638651341537070000/reb89/highres/3/R2937173_17.jpg,https://cdn.realtor.ca/listing/TS638651341537200000/reb89/highres/3/R2937173_18.jpg,https://cdn.realtor.ca/listing/TS638651341544130000/reb89/highres/3/R2937173_19.jpg,https://cdn.realtor.ca/listing/TS638651341544130000/reb89/highres/3/R2937173_20.jpg,https://cdn.realtor.ca/listing/TS638651341544500000/reb89/highres/3/R2937173_21.jpg,https://cdn.realtor.ca/listing/TS638651341537270000/reb89/highres/3/R2937173_22.jpg,https://cdn.realtor.ca/listing/TS638651341537030000/reb89/highres/3/R2937173_23.jpg,https://cdn.realtor.ca/listing/TS638651341537070000/reb89/highres/3/R2937173_24.jpg,https://cdn.realtor.ca/listing/TS638651341544170000/reb89/highres/3/R2937173_25.jpg,https://cdn.realtor.ca/listing/TS638651341543900000/reb89/highres/3/R2937173_26.jpg,https://cdn.realtor.ca/listing/TS638651341537030000/reb89/highres/3/R2937173_27.jpg,https://cdn.realtor.ca/listing/TS638651341537000000/reb89/highres/3/R2937173_28.jpg,https://cdn.realtor.ca/listing/TS638651341532800000/reb89/highres/3/R2937173_29.jpg,https://cdn.realtor.ca/listing/TS638651341545130000/reb89/highres/3/R2937173_30.jpg,,,,,,,,,,
