,Unnamed: 0,index,id,PublicRemarks_x,Bathroom,Bedrooms,Sqft,Price,Type_x,Address,Longitude,Latitude,PostalCode,Id,MlsNumber,PublicRemarks_y,Type_y,Amenities,ArchitecturalStyle,ConstructedDate,HeatingType,BuiltIn,Parking1,Parking2,OwnershipType,MaintenanceFee,TaxAmount,PreviousClosePrice,PreviousSaleDate,image_1,image_2,image_3,image_4,image_5,image_6,image_7,image_8,image_9,image_10,image_11,image_12,image_13,image_14,image_15,image_16,image_17,image_18,image_19,image_20,image_21,image_22,image_23,image_24,image_25,image_26,image_27,image_28,image_29,image_30,image_31,image_32,image_33,image_34,image_35,image_36,image_37,image_38,image_39,image_40
26,26,23,26719127,"Well maintained south facing home in prestigious West Point Grey neighbourhood. This great home offers great living spaces with 4 bedrooms and 4 bathrooms.Upper level features 3 bedrooms including a master bedroom with jetted bathtub. Lower level has recreation room plus a den. School catchment: Queen Mary Elementary & Lord Byng Secondary. Minutes walk to Safeway, Starbucks, restaurants, and banks. (29586532)",4.0,4.0,2759,3490000,Single Family,"4589 W 9TH AVENUE|Vancouver, British Columbia V6R2E2",-123.211781,49.264979,V6R2E2,26719127,R2867405,"Well maintained south facing home in prestigious West Point Grey neighbourhood. This great home offers great living spaces with 4 bedrooms and 4 bathrooms.Upper level features 3 bedrooms including a master bedroom with jetted bathtub. Lower level has recreation room plus a den. School catchment: Queen Mary Elementary & Lord Byng Secondary. Minutes walk to Safeway, Starbucks, restaurants, and banks. (29586532)",House,N/A,2 Level,1996,"Hot Water, Radiant heat",1996,Garage,2,Freehold,N/A,"$9,815.50","$3,080,000",2016-02-27,https://cdn.realtor.ca/listing/TS638483551870700000/reb89/highres/5/R2867405_1.jpg,https://cdn.realtor.ca/listing/TS638483551846130000/reb89/highres/5/R2867405_2.jpg,https://cdn.realtor.ca/listing/TS638483551844870000/reb89/highres/5/R2867405_3.jpg,https://cdn.realtor.ca/listing/TS638483551870470000/reb89/highres/5/R2867405_4.jpg,https://cdn.realtor.ca/listing/TS638483551930670000/reb89/highres/5/R2867405_5.jpg,https://cdn.realtor.ca/listing/TS638483551870570000/reb89/highres/5/R2867405_6.jpg,https://cdn.realtor.ca/listing/TS638483551870670000/reb89/highres/5/R2867405_7.jpg,https://cdn.realtor.ca/listing/TS638483551846130000/reb89/highres/5/R2867405_8.jpg,https://cdn.realtor.ca/listing/TS638483551870400000/reb89/highres/5/R2867405_9.jpg,https://cdn.realtor.ca/listing/TS638483551844870000/reb89/highres/5/R2867405_10.jpg,https://cdn.realtor.ca/listing/TS638483551882000000/reb89/highres/5/R2867405_11.jpg,https://cdn.realtor.ca/listing/TS638483551870570000/reb89/highres/5/R2867405_12.jpg,https://cdn.realtor.ca/listing/TS638483551870600000/reb89/highres/5/R2867405_13.jpg,https://cdn.realtor.ca/listing/TS638483551846170000/reb89/highres/5/R2867405_14.jpg,https://cdn.realtor.ca/listing/TS638483551847770000/reb89/highres/5/R2867405_15.jpg,https://cdn.realtor.ca/listing/TS638483551847830000/reb89/highres/5/R2867405_16.jpg,https://cdn.realtor.ca/listing/TS638483551931000000/reb89/highres/5/R2867405_17.jpg,https://cdn.realtor.ca/listing/TS638483551882200000/reb89/highres/5/R2867405_18.jpg,https://cdn.realtor.ca/listing/TS638483551870870000/reb89/highres/5/R2867405_19.jpg,https://cdn.realtor.ca/listing/TS638483551847770000/reb89/highres/5/R2867405_20.jpg,https://cdn.realtor.ca/listing/TS638483551846130000/reb89/highres/5/R2867405_21.jpg,https://cdn.realtor.ca/listing/TS638483551846070000/reb89/highres/5/R2867405_22.jpg,https://cdn.realtor.ca/listing/TS638483551930570000/reb89/highres/5/R2867405_23.jpg,https://cdn.realtor.ca/listing/TS638483551844870000/reb89/highres/5/R2867405_24.jpg,https://cdn.realtor.ca/listing/TS638483551844870000/reb89/highres/5/R2867405_25.jpg,https://cdn.realtor.ca/listing/TS638483551882100000/reb89/highres/5/R2867405_26.jpg,https://cdn.realtor.ca/listing/TS638483551846070000/reb89/highres/5/R2867405_27.jpg,https://cdn.realtor.ca/listing/TS638483551847770000/reb89/highres/5/R2867405_28.jpg,https://cdn.realtor.ca/listing/TS638483551846070000/reb89/highres/5/R2867405_29.jpg,https://cdn.realtor.ca/listing/TS638483551930870000/reb89/highres/5/R2867405_30.jpg,https://cdn.realtor.ca/listing/TS638483551846070000/reb89/highres/5/R2867405_31.jpg,https://cdn.realtor.ca/listing/TS638483551931200000/reb89/highres/5/R2867405_32.jpg,,,,,,,,
27,27,22,27456615,"Breathtaking ocean view at the most desirable Point Gray area. This superbly renovated home with open concept floor plan. Ceiling to floor windows views over Spanish Banks, downtown and the North Shore Mountains. Upgraded kitchen, hardwood floors, and internal paint. Downstairs with huge family room and bedroom which is easy to convert to a rental suite. South facing back yard with huge patio can enjoy the party and garden. Great location to raise family or to build your dream mansion there! Best school catchment: Queen Elizabeth Elementary, Lord Byng Secondary, West Point Grey private school. Close to UBC, Golf Course, beaches, and 10th Ave shopping and cafes. Must see to appreciate! open house sep 29 (Sun) 2-4 pm (30385178)",2.0,3.0,2040,3488000,Single Family,"3762 W 13TH AVENUE|Vancouver, British Columbia V6R2S6",-123.187222,49.260575,V6R2S6,27456615,R2928563,"Breathtaking ocean view at the most desirable Point Gray area. This superbly renovated home with open concept floor plan. Ceiling to floor windows views over Spanish Banks, downtown and the North Shore Mountains. Upgraded kitchen, hardwood floors, and internal paint. Downstairs with huge family room and bedroom which is easy to convert to a rental suite. South facing back yard with huge patio can enjoy the party and garden. Great location to raise family or to build your dream mansion there! Best school catchment: Queen Elizabeth Elementary, Lord Byng Secondary, West Point Grey private school. Close to UBC, Golf Course, beaches, and 10th Ave shopping and cafes. Must see to appreciate! open house sep 29 (Sun) 2-4 pm (30385178)",House,N/A,2 Level,1936,Forced air,1936,Garage,2,Freehold,N/A,"$11,085.70","$3,600,000",2016-03-06,https://cdn.realtor.ca/listing/TS638627077523470000/reb89/highres/3/R2928563_1.jpg,https://cdn.realtor.ca/listing/TS638627077563170000/reb89/highres/3/R2928563_2.jpg,https://cdn.realtor.ca/listing/TS638627077563170000/reb89/highres/3/R2928563_3.jpg,https://cdn.realtor.ca/listing/TS638627077523500000/reb89/highres/3/R2928563_4.jpg,https://cdn.realtor.ca/listing/TS638627077568170000/reb89/highres/3/R2928563_5.jpg,https://cdn.realtor.ca/listing/TS638627077523470000/reb89/highres/3/R2928563_6.jpg,https://cdn.realtor.ca/listing/TS638627077523500000/reb89/highres/3/R2928563_7.jpg,https://cdn.realtor.ca/listing/TS638627077523500000/reb89/highres/3/R2928563_8.jpg,https://cdn.realtor.ca/listing/TS638627077522800000/reb89/highres/3/R2928563_9.jpg,https://cdn.realtor.ca/listing/TS638627077567730000/reb89/highres/3/R2928563_10.jpg,https://cdn.realtor.ca/listing/TS638627077523470000/reb89/highres/3/R2928563_11.jpg,https://cdn.realtor.ca/listing/TS638627077568130000/reb89/highres/3/R2928563_12.jpg,https://cdn.realtor.ca/listing/TS638627077568130000/reb89/highres/3/R2928563_13.jpg,https://cdn.realtor.ca/listing/TS638627077556900000/reb89/highres/3/R2928563_14.jpg,https://cdn.realtor.ca/listing/TS638627077522870000/reb89/highres/3/R2928563_15.jpg,https://cdn.realtor.ca/listing/TS638627077570500000/reb89/highres/3/R2928563_16.jpg,https://cdn.realtor.ca/listing/TS638627077567970000/reb89/highres/3/R2928563_17.jpg,https://cdn.realtor.ca/listing/TS638627077570500000/reb89/highres/3/R2928563_18.jpg,https://cdn.realtor.ca/listing/TS638627077570500000/reb89/highres/3/R2928563_19.jpg,https://cdn.realtor.ca/listing/TS638627077568270000/reb89/highres/3/R2928563_20.jpg,https://cdn.realtor.ca/listing/TS638627077568030000/reb89/highres/3/R2928563_21.jpg,https://cdn.realtor.ca/listing/TS638627077568230000/reb89/highres/3/R2928563_22.jpg,https://cdn.realtor.ca/listing/TS638627077570500000/reb89/highres/3/R2928563_23.jpg,https://cdn.realtor.ca/listing/TS638627077570500000/reb89/highres/3/R2928563_24.jpg,https://cdn.realtor.ca/listing/TS638627077570500000/reb89/highres/3/R2928563_25.jpg,https://cdn.realtor.ca/listing/TS638627077587370000/reb89/highres/3/R2928563_26.jpg,https://cdn.realtor.ca/listing/TS638627077568300000/reb89/highres/3/R2928563_27.jpg,https://cdn.realtor.ca/listing/TS638627077568100000/reb89/highres/3/R2928563_28.jpg,,,,,,,,,,,,
28,28,21,27364934,"This West Coast Contemporary home situated in one of Vancouver's most prestigious neighbourhood, West Pont Grey! With 4 bedroom, 3 bathrooms and sauna.  The split level home features an open concept kitchen which opens to vaulted BRIGHT flex space.  Enjoy BREATHTAKING  PANORAMIC VIEWS of the city, mountains and OCEAN VIEWS from both LARGE DECKS perfect for entertaining and only a short walk to the BEACH.  Must be seen...this home is truly special.  close to Vancouver's finest school, transportation and all amenities (30285905)",3.0,4.0,3623,3388000,Single Family,"4570 W 4TH AVENUE|Vancouver, British Columbia V6R1R3",-123.211006,49.268789,V6R1R3,,,,,,,,,,,,,,,,,,,,,,,,,,,,,,,,,,,,,,,,,,,,,,,,,,,,,,,,
29,29,20,27533676,"A charming 4 Bed + 4 Bath family home nestled in the prestigious Point Grey. Immaculately maintained and cared over years. Located on a QUIET tree-lined street, very inch of land is precious! Blocks to Jericho Beach Park and other 6 parks; within 5 minutes drive to UBC, Lord Byng Secondary, West Point Grey Academy, Queen Elizabeth Elementary, and the famous private secondary school Our Lady of Perpetual Help. A variety of shops, restaurants, and cafes, providing residents with convenient access to amenities and services. Great place to live and a rare investment opportunity. (30468690)",4.0,4.0,2992,3248000,Single Family,"4553 W 8TH AVENUE|Vancouver, British Columbia V6R2A4",-123.210626,49.265834,V6R2A4,,,,,,,,,,,,,,,,,,,,,,,,,,,,,,,,,,,,,,,,,,,,,,,,,,,,,,,,
30,30,19,27574477,"Beautiful water and mountain VIEW 33x122 property in Point Grey! Sitting on the higher side of the street w/a sunny South facing backyard! This large 2936 sf Victorian style house was tastefully renovated in 2022 with new laminate floors, elegant light fixtures, crystal chandeliers, S/S appliances, sleek bathrooms, a fully finished bsmt.  New water heater tank and new exterior paint in Fall 2024. 2 bedrooms and 4 piece bath on the main; master bdrm with an ensuite bath on the 2nd lvl w/a water view balcony; A large rec room (could be a bdrm),1 full bath & 1 bdrm in the bsmt which is possible to be turned into a suite. Charming stained glass, wood panelling & high wainscotting throughout. Lord Byng, Queen Elizabeth Elem catchment; short drive to UBC, WPGA, St. Georges. OH: Sun (Nov 3) 2-4. (30512832)",3.0,4.0,3006,3088000,Single Family,"4190 W 11TH AVENUE|Vancouver, British Columbia V6R2L6",-123.199546,49.262626,V6R2L6,27574477,R2938355,"Beautiful water and mountain VIEW 33x122 property in Point Grey! Sitting on the higher side of the street w/a sunny South facing backyard! This large 2936 sf Victorian style house was tastefully renovated in 2022 with new laminate floors, elegant light fixtures, crystal chandeliers, S/S appliances, sleek bathrooms, a fully finished bsmt.  New water heater tank and new exterior paint in Fall 2024. 2 bedrooms and 4 piece bath on the main; master bdrm with an ensuite bath on the 2nd lvl w/a water view balcony; A large rec room (could be a bdrm),1 full bath & 1 bdrm in the bsmt which is possible to be turned into a suite. Charming stained glass, wood panelling & high wainscotting throughout. Lord Byng, Queen Elizabeth Elem catchment; short drive to UBC, WPGA, St. Georges. OH: Sun (Nov 3) 2-4. (30512832)",House,N/A,2 Level,1913,"Forced air, (Natural gas)",1913,Carport,N/A,Freehold,N/A,"$10,459.50","$2,740,000",2018-04-06,https://cdn.realtor.ca/listing/TS638653749616130000/reb89/highres/5/R2938355_1.jpg,https://cdn.realtor.ca/listing/TS638653749677300000/reb89/highres/5/R2938355_2.jpg,https://cdn.realtor.ca/listing/TS638653749678100000/reb89/highres/5/R2938355_3.jpg,https://cdn.realtor.ca/listing/TS638653749677630000/reb89/highres/5/R2938355_4.jpg,https://cdn.realtor.ca/listing/TS638653749677630000/reb89/highres/5/R2938355_5.jpg,https://cdn.realtor.ca/listing/TS638653749616200000/reb89/highres/5/R2938355_6.jpg,https://cdn.realtor.ca/listing/TS638653749677600000/reb89/highres/5/R2938355_7.jpg,https://cdn.realtor.ca/listing/TS638653749677330000/reb89/highres/5/R2938355_8.jpg,https://cdn.realtor.ca/listing/TS638653749677300000/reb89/highres/5/R2938355_9.jpg,https://cdn.realtor.ca/listing/TS638653749621200000/reb89/highres/5/R2938355_10.jpg,https://cdn.realtor.ca/listing/TS638653749616130000/reb89/highres/5/R2938355_11.jpg,https://cdn.realtor.ca/listing/TS638653749621930000/reb89/highres/5/R2938355_12.jpg,https://cdn.realtor.ca/listing/TS638653749677500000/reb89/highres/5/R2938355_13.jpg,https://cdn.realtor.ca/listing/TS638653749677530000/reb89/highres/5/R2938355_14.jpg,https://cdn.realtor.ca/listing/TS638653749677400000/reb89/highres/5/R2938355_15.jpg,https://cdn.realtor.ca/listing/TS638653749677370000/reb89/highres/5/R2938355_16.jpg,https://cdn.realtor.ca/listing/TS638653749684200000/reb89/highres/5/R2938355_17.jpg,https://cdn.realtor.ca/listing/TS638653749677370000/reb89/highres/5/R2938355_18.jpg,https://cdn.realtor.ca/listing/TS638653749765030000/reb89/highres/5/R2938355_19.jpg,https://cdn.realtor.ca/listing/TS638653749771670000/reb89/highres/5/R2938355_20.jpg,https://cdn.realtor.ca/listing/TS638653749678200000/reb89/highres/5/R2938355_21.jpg,https://cdn.realtor.ca/listing/TS638653749765300000/reb89/highres/5/R2938355_22.jpg,https://cdn.realtor.ca/listing/TS638653749765400000/reb89/highres/5/R2938355_23.jpg,https://cdn.realtor.ca/listing/TS638653749765030000/reb89/highres/5/R2938355_24.jpg,https://cdn.realtor.ca/listing/TS638653749677400000/reb89/highres/5/R2938355_25.jpg,https://cdn.realtor.ca/listing/TS638653749677630000/reb89/highres/5/R2938355_26.jpg,,,,,,,,,,,,,,
31,31,18,27006588,"Investor & Builder ALERT!!!Exceptional investment opportunity in Vancouver West Point Grey! Located just one step to transit, UBC, Pacific Spirit Regional Park and beaches. 7 Bedrooms & 2 Kitchens ample space for large families or multiple tenants, making it perfect for student housing or shared living arrangements. Renovated in 2014 with new roof, flooring, kitchen appliances, and windows ensuring comfort and functionality. Can potentially rent over $9000 per month which promises excellent returns and steady cash flow. Perfect for live in or hold for development! School Catchments are Queen Elizabeth Elementary, Lord Byng Secondary and French Immersion - Kitsilano Secondary. Open House : Nov 16th(Sat)2-4pm (29898386)",3.0,7.0,2035,2950000,Single Family,"4663 W 15TH AVENUE|Vancouver, British Columbia V6R3B5",-123.214182,49.259596,V6R3B5,27006588,R2891798,"Investor & Builder ALERT!!!Exceptional investment opportunity in Vancouver West Point Grey! Located just one step to transit, UBC, Pacific Spirit Regional Park and beaches. 7 Bedrooms & 2 Kitchens ample space for large families or multiple tenants, making it perfect for student housing or shared living arrangements. Renovated in 2014 with new roof, flooring, kitchen appliances, and windows ensuring comfort and functionality. Can potentially rent over $9000 per month which promises excellent returns and steady cash flow. Perfect for live in or hold for development! School Catchments are Queen Elizabeth Elementary, Lord Byng Secondary and French Immersion - Kitsilano Secondary. Open House : Nov 16th(Sat)2-4pm (29898386)",House,N/A,2 Level,1956,"Baseboard heaters, (Electric)",1956,Carport,1,Freehold,N/A,"$9,888.63","$2,738,000",2021-03-22,https://cdn.realtor.ca/listing/TS638537532763430000/reb89/highres/8/R2891798_1.jpg,https://cdn.realtor.ca/listing/TS638537532727200000/reb89/highres/8/R2891798_2.jpg,https://cdn.realtor.ca/listing/TS638537532727470000/reb89/highres/8/R2891798_3.jpg,https://cdn.realtor.ca/listing/TS638537532755930000/reb89/highres/8/R2891798_4.jpg,https://cdn.realtor.ca/listing/TS638537532727270000/reb89/highres/8/R2891798_5.jpg,https://cdn.realtor.ca/listing/TS638537532763700000/reb89/highres/8/R2891798_6.jpg,https://cdn.realtor.ca/listing/TS638537532693070000/reb89/highres/8/R2891798_7.jpg,https://cdn.realtor.ca/listing/TS638537532762530000/reb89/highres/8/R2891798_8.jpg,https://cdn.realtor.ca/listing/TS638537532693070000/reb89/highres/8/R2891798_9.jpg,https://cdn.realtor.ca/listing/TS638537532693070000/reb89/highres/8/R2891798_10.jpg,https://cdn.realtor.ca/listing/TS638537532763230000/reb89/highres/8/R2891798_11.jpg,https://cdn.realtor.ca/listing/TS638537532755770000/reb89/highres/8/R2891798_12.jpg,https://cdn.realtor.ca/listing/TS638534952932230000/reb89/highres/8/R2891798_13.jpg,https://cdn.realtor.ca/listing/TS638537532763030000/reb89/highres/8/R2891798_14.jpg,https://cdn.realtor.ca/listing/TS638537532693070000/reb89/highres/8/R2891798_15.jpg,https://cdn.realtor.ca/listing/TS638537532763130000/reb89/highres/8/R2891798_16.jpg,https://cdn.realtor.ca/listing/TS638537532726770000/reb89/highres/8/R2891798_17.jpg,https://cdn.realtor.ca/listing/TS638537532860070000/reb89/highres/8/R2891798_18.jpg,https://cdn.realtor.ca/listing/TS638537532763200000/reb89/highres/8/R2891798_19.jpg,https://cdn.realtor.ca/listing/TS638537532763130000/reb89/highres/8/R2891798_20.jpg,https://cdn.realtor.ca/listing/TS638537532763330000/reb89/highres/8/R2891798_21.jpg,https://cdn.realtor.ca/listing/TS638537532755770000/reb89/highres/8/R2891798_22.jpg,https://cdn.realtor.ca/listing/TS638537532763200000/reb89/highres/8/R2891798_23.jpg,https://cdn.realtor.ca/listing/TS638537532763500000/reb89/highres/8/R2891798_24.jpg,https://cdn.realtor.ca/listing/TS638537532651430000/reb89/highres/8/R2891798_25.jpg,https://cdn.realtor.ca/listing/TS638537532644570000/reb89/highres/8/R2891798_26.jpg,,,,,,,,,,,,,,
32,32,17,27461530,"UPDATED charming house w/the best curb appeal in prestigious Point Grey! 33X122 flat property surrounded by new homes. Main flr features formal living & dining, 2 bdrms & 1full bath, kitchen equipped with elegant cabinetry & S/S appliances. Fully developed attic space with washer, dryer & roughed in bathroom pipes; basement boasts a 2 bdrm suite which was put in 2005 w/new plumbing and wiring by licensed trades. Tons of updates: Pella windows, Lennox furnace in 2005, 10 year old roof w/25 year warranty, on demand hot water sys, extra insulation between the suite and the upper level, single garage which could be used as a studio. Fantastic location: Lord Byng Sec. & Queen Elizabeth Elem. Short drive to UBC, WPGA, W. 10th shopping & beaches. OH: Sun (Nov 3) 2-4pm. (30390730)",2.0,5.0,2073,2888000,Single Family,"4477 W 15TH AVENUE|Vancouver, British Columbia V6R3B1",-123.208519,49.259507,V6R3B1,27461530,R2929200,"UPDATED charming house w/the best curb appeal in prestigious Point Grey! 33X122 flat property surrounded by new homes. Main flr features formal living & dining, 2 bdrms & 1full bath, kitchen equipped with elegant cabinetry & S/S appliances. Fully developed attic space with washer, dryer & roughed in bathroom pipes; basement boasts a 2 bdrm suite which was put in 2005 w/new plumbing and wiring by licensed trades. Tons of updates: Pella windows, Lennox furnace in 2005, 10 year old roof w/25 year warranty, on demand hot water sys, extra insulation between the suite and the upper level, single garage which could be used as a studio. Fantastic location: Lord Byng Sec. & Queen Elizabeth Elem. Short drive to UBC, WPGA, W. 10th shopping & beaches. OH: Sun (Nov 3) 2-4pm. (30390730)",House,N/A,2 Level,1941,"Baseboard heaters, Forced air, Radiant heat",1941,Garage,N/A,Freehold,N/A,"$10,054.40","$650,000",2005-02-11,https://cdn.realtor.ca/listing/TS638628679951000000/reb89/highres/0/R2929200_1.jpg,https://cdn.realtor.ca/listing/TS638628679950700000/reb89/highres/0/R2929200_2.jpg,https://cdn.realtor.ca/listing/TS638628680000230000/reb89/highres/0/R2929200_3.jpg,https://cdn.realtor.ca/listing/TS638628679951370000/reb89/highres/0/R2929200_4.jpg,https://cdn.realtor.ca/listing/TS638628679952030000/reb89/highres/0/R2929200_5.jpg,https://cdn.realtor.ca/listing/TS638628679953500000/reb89/highres/0/R2929200_6.jpg,https://cdn.realtor.ca/listing/TS638628679951300000/reb89/highres/0/R2929200_7.jpg,https://cdn.realtor.ca/listing/TS638628679951630000/reb89/highres/0/R2929200_8.jpg,https://cdn.realtor.ca/listing/TS638628679951200000/reb89/highres/0/R2929200_9.jpg,https://cdn.realtor.ca/listing/TS638628679951100000/reb89/highres/0/R2929200_10.jpg,https://cdn.realtor.ca/listing/TS638628679951600000/reb89/highres/0/R2929200_11.jpg,https://cdn.realtor.ca/listing/TS638628679950500000/reb89/highres/0/R2929200_12.jpg,https://cdn.realtor.ca/listing/TS638628679951000000/reb89/highres/0/R2929200_13.jpg,https://cdn.realtor.ca/listing/TS638628679951030000/reb89/highres/0/R2929200_14.jpg,https://cdn.realtor.ca/listing/TS638628679951700000/reb89/highres/0/R2929200_15.jpg,https://cdn.realtor.ca/listing/TS638628679927200000/reb89/highres/0/R2929200_16.jpg,https://cdn.realtor.ca/listing/TS638628679927200000/reb89/highres/0/R2929200_17.jpg,https://cdn.realtor.ca/listing/TS638628679953500000/reb89/highres/0/R2929200_18.jpg,https://cdn.realtor.ca/listing/TS638627929616300000/reb89/highres/0/R2929200_19.jpg,,,,,,,,,,,,,,,,,,,,,
