,Unnamed: 0,index,id,PublicRemarks_x,Bathroom,Bedrooms,Sqft,Price,Type_x,Address,Longitude,Latitude,PostalCode,Id,MlsNumber,PublicRemarks_y,Type_y,Amenities,ArchitecturalStyle,ConstructedDate,HeatingType,BuiltIn,Parking1,Parking2,OwnershipType,MaintenanceFee,TaxAmount,PreviousClosePrice,PreviousSaleDate,image_1,image_2,image_3,image_4,image_5,image_6,image_7,image_8,image_9,image_10,image_11,image_12,image_13,image_14,image_15,image_16,image_17,image_18,image_19,image_20,image_21,image_22,image_23,image_24,image_25,image_26,image_27,image_28,image_29,image_30,image_31,image_32,image_33,image_34,image_35,image_36,image_37,image_38,image_39,image_40
12,12,37,27238393,"ONE OF KIND ENJOY THIS UNOBSTRUCTED BREATHTAKING VIEWS OF MOUNTAINS, CITY & WATER. AN EXCEPTIONAL UNIQUE WEST COAST CONTEMPORARY NEW HOME. IN MOST PRESTIGIOUS POINT GREY LOCATION. This beautiful home simply offers Over 3,600 sq.ft. PLUS amazing Rooftop 867 sq.ft.. QUALITY is built into every detail. height ceiling, open spacious gourmet kitchen with high-end kitchen cabinetry & stainless appliances. Total 5 bedrooms + den, 5.5 baths. Offers Steam Shower, Sauna, Entertainment room, Wet bar, Radiant floor heating, A/C, HRV, HOME SMART SECURITY SYSTEM. Separate entrance legal One-bedroom suite with bath, kitchen, washer and dryer in lower level as mortgage helper. School catchment; LORD BYNG & QUEEN ELIZABETH ELEMENTARY. CLOSE TO WEST POINT GREY ACADEMY, ST. GEORGE'S PRIVTE SCHOOL, UBC, SHOPPING & BUS. MUST SEE ! (30149380)",6.0,5.0,3604,4880000,Single Family,"3635 W 14TH AVENUE|Vancouver, British Columbia V6R2W6",-123.184725,49.260021,V6R2W6,27238393,R2910987,"ONE OF KIND ENJOY THIS UNOBSTRUCTED BREATHTAKING VIEWS OF MOUNTAINS, CITY & WATER. AN EXCEPTIONAL UNIQUE WEST COAST CONTEMPORARY NEW HOME. IN MOST PRESTIGIOUS POINT GREY LOCATION. This beautiful home simply offers Over 3,600 sq.ft. PLUS amazing Rooftop 867 sq.ft.. QUALITY is built into every detail. height ceiling, open spacious gourmet kitchen with high-end kitchen cabinetry & stainless appliances. Total 5 bedrooms + den, 5.5 baths. Offers Steam Shower, Sauna, Entertainment room, Wet bar, Radiant floor heating, A/C, HRV, HOME SMART SECURITY SYSTEM. Separate entrance legal One-bedroom suite with bath, kitchen, washer and dryer in lower level as mortgage helper. School catchment; LORD BYNG & QUEEN ELIZABETH ELEMENTARY. CLOSE TO WEST POINT GREY ACADEMY, ST. GEORGE'S PRIVTE SCHOOL, UBC, SHOPPING & BUS. MUST SEE ! (30149380)",House,N/A,2 Level,2024,"Hot Water, (Natural gas), Radiant heat",2024,Garage,1,Freehold,N/A,"$9,928.35","$2,500,000",2021-12-14,https://cdn.realtor.ca/listing/TS638665957789000000/reb89/highres/7/R2910987_1.jpg,https://cdn.realtor.ca/listing/TS638665957779270000/reb89/highres/7/R2910987_2.jpg,https://cdn.realtor.ca/listing/TS638665957782100000/reb89/highres/7/R2910987_3.jpg,https://cdn.realtor.ca/listing/TS638665957778100000/reb89/highres/7/R2910987_4.jpg,https://cdn.realtor.ca/listing/TS638665957788100000/reb89/highres/7/R2910987_5.jpg,https://cdn.realtor.ca/listing/TS638665957778100000/reb89/highres/7/R2910987_6.jpg,https://cdn.realtor.ca/listing/TS638665957781500000/reb89/highres/7/R2910987_7.jpg,https://cdn.realtor.ca/listing/TS638665957789000000/reb89/highres/7/R2910987_8.jpg,https://cdn.realtor.ca/listing/TS638665957782130000/reb89/highres/7/R2910987_9.jpg,https://cdn.realtor.ca/listing/TS638665957779370000/reb89/highres/7/R2910987_10.jpg,https://cdn.realtor.ca/listing/TS638665957779230000/reb89/highres/7/R2910987_11.jpg,https://cdn.realtor.ca/listing/TS638665957779200000/reb89/highres/7/R2910987_12.jpg,https://cdn.realtor.ca/listing/TS638665957782100000/reb89/highres/7/R2910987_13.jpg,https://cdn.realtor.ca/listing/TS638665957779300000/reb89/highres/7/R2910987_14.jpg,https://cdn.realtor.ca/listing/TS638665957787930000/reb89/highres/7/R2910987_15.jpg,https://cdn.realtor.ca/listing/TS638665957778130000/reb89/highres/7/R2910987_16.jpg,https://cdn.realtor.ca/listing/TS638665957778100000/reb89/highres/7/R2910987_17.jpg,https://cdn.realtor.ca/listing/TS638665957782100000/reb89/highres/7/R2910987_18.jpg,https://cdn.realtor.ca/listing/TS638665957789000000/reb89/highres/7/R2910987_19.jpg,https://cdn.realtor.ca/listing/TS638665957788830000/reb89/highres/7/R2910987_20.jpg,https://cdn.realtor.ca/listing/TS638665957779330000/reb89/highres/7/R2910987_21.jpg,https://cdn.realtor.ca/listing/TS638665957788470000/reb89/highres/7/R2910987_22.jpg,,,,,,,,,,,,,,,,,,
13,13,36,27402424,"POPULAR POINT GREY LOCATION ! Fabulous home almost 4,200 sq.ft. sits on a huge lot 55' x 122' ( 6,710 sq.ft.). Featuring 17"" high ceiling foyer with curved staircase up to the second floor with 5 bedrooms, 4.5 baths, Spacious master bedroom with ensuite. Main floor has excellent layout with entertaining sized living and dining, office beside the entrance, Large open gourmet kitchen with great room overlooking the park like back yard, Radiant floor heating system, Recreation room with washer room in the basement. Steps away from LORD BING HIGH SCHOOL, QUEEN ELIZABETH ELEMENTARY. CLOSE TO WEST POINT GREY ACADEMY, ST. GEORGE'S, CORFTON & YORK HOUSE PRIVATE SCHOOL, UBC, GOLF COURSE, SHOPPING & BUS. SOUTHERN BACKYARD EXPOSURE. MUST SEE ! (30326847)",5.0,5.0,4149,4880000,Single Family,"4570 W 13TH AVENUE|Vancouver, British Columbia V6R2V4",-123.211323,49.260919,V6R2V4,27402424,R2924423,"POPULAR POINT GREY LOCATION ! Fabulous home almost 4,200 sq.ft. sits on a huge lot 55' x 122' ( 6,710 sq.ft.). Featuring 17"" high ceiling foyer with curved staircase up to the second floor with 5 bedrooms, 4.5 baths, Spacious master bedroom with ensuite. Main floor has excellent layout with entertaining sized living and dining, office beside the entrance, Large open gourmet kitchen with great room overlooking the park like back yard, Radiant floor heating system, Recreation room with washer room in the basement. Steps away from LORD BING HIGH SCHOOL, QUEEN ELIZABETH ELEMENTARY. CLOSE TO WEST POINT GREY ACADEMY, ST. GEORGE'S, CORFTON & YORK HOUSE PRIVATE SCHOOL, UBC, GOLF COURSE, SHOPPING & BUS. SOUTHERN BACKYARD EXPOSURE. MUST SEE ! (30326847)",House,N/A,2 Level,1987,"(Electric), (Natural gas)",1987,Garage,2,Freehold,N/A,"$15,901.20","$1,558,000",2008-11-05,https://cdn.realtor.ca/listing/TS638665063375130000/reb89/highres/3/R2924423_1.jpg,https://cdn.realtor.ca/listing/TS638665063375070000/reb89/highres/3/R2924423_2.jpg,https://cdn.realtor.ca/listing/TS638665063383800000/reb89/highres/3/R2924423_3.jpg,https://cdn.realtor.ca/listing/TS638665063349730000/reb89/highres/3/R2924423_4.jpg,https://cdn.realtor.ca/listing/TS638665063375130000/reb89/highres/3/R2924423_5.jpg,https://cdn.realtor.ca/listing/TS638665063375270000/reb89/highres/3/R2924423_6.jpg,https://cdn.realtor.ca/listing/TS638665063376870000/reb89/highres/3/R2924423_7.jpg,https://cdn.realtor.ca/listing/TS638665063375300000/reb89/highres/3/R2924423_8.jpg,https://cdn.realtor.ca/listing/TS638665063375270000/reb89/highres/3/R2924423_9.jpg,https://cdn.realtor.ca/listing/TS638665063355600000/reb89/highres/3/R2924423_10.jpg,https://cdn.realtor.ca/listing/TS638665063349870000/reb89/highres/3/R2924423_11.jpg,https://cdn.realtor.ca/listing/TS638665063357430000/reb89/highres/3/R2924423_12.jpg,https://cdn.realtor.ca/listing/TS638665063358300000/reb89/highres/3/R2924423_13.jpg,https://cdn.realtor.ca/listing/TS638665063349730000/reb89/highres/3/R2924423_14.jpg,https://cdn.realtor.ca/listing/TS638665063375100000/reb89/highres/3/R2924423_15.jpg,https://cdn.realtor.ca/listing/TS638665063357100000/reb89/highres/3/R2924423_16.jpg,https://cdn.realtor.ca/listing/TS638665063375230000/reb89/highres/3/R2924423_17.jpg,https://cdn.realtor.ca/listing/TS638665063375100000/reb89/highres/3/R2924423_18.jpg,https://cdn.realtor.ca/listing/TS638665063375230000/reb89/highres/3/R2924423_19.jpg,https://cdn.realtor.ca/listing/TS638665063375270000/reb89/highres/3/R2924423_20.jpg,https://cdn.realtor.ca/listing/TS638665063375370000/reb89/highres/3/R2924423_21.jpg,https://cdn.realtor.ca/listing/TS638665063382270000/reb89/highres/3/R2924423_22.jpg,,,,,,,,,,,,,,,,,,
14,14,35,27464982,"Tranquil desirable Point Grey location with Mountain view. One block to Pacific Spirit Park & bus line, 5 blocks to West 10th Avenue shopping community. Lord Byng, Jules Quesnel & Queen Elizabeth school catchments, easy access to UBC & St. Georges. This luxury home features 4 bedrooms, 5 1/2 bathrooms, one bedroom suite with rough-in kitchen, air conditioning, HRV, Wok kitchen, open and practical plan, beautiful family room leads to the extra sun deck, rooftop deck with views, theatre room, intelligent audio system, security system and much more... this is the one you never miss. (30394683)",6.0,4.0,2760,4680000,Single Family,"4627 W 15TH AVENUE|Vancouver, British Columbia V6R3B5",-123.213233,49.259563,V6R3B5,27464982,R2929701,"Tranquil desirable Point Grey location with Mountain view. One block to Pacific Spirit Park & bus line, 5 blocks to West 10th Avenue shopping community. Lord Byng, Jules Quesnel & Queen Elizabeth school catchments, easy access to UBC & St. Georges. This luxury home features 4 bedrooms, 5 1/2 bathrooms, one bedroom suite with rough-in kitchen, air conditioning, HRV, Wok kitchen, open and practical plan, beautiful family room leads to the extra sun deck, rooftop deck with views, theatre room, intelligent audio system, security system and much more... this is the one you never miss. (30394683)",House,N/A,2 Level,2019,"Hot Water, (Natural gas), Radiant heat",2019,Garage,2,Freehold,N/A,"$14,177.40","$2,930,000",2017-05-17,https://cdn.realtor.ca/listing/TS638628794195700000/reb89/highres/1/R2929701_1.jpg,https://cdn.realtor.ca/listing/TS638628794201800000/reb89/highres/1/R2929701_2.jpg,https://cdn.realtor.ca/listing/TS638628794195670000/reb89/highres/1/R2929701_3.jpg,https://cdn.realtor.ca/listing/TS638628794195670000/reb89/highres/1/R2929701_4.jpg,https://cdn.realtor.ca/listing/TS638628794201770000/reb89/highres/1/R2929701_5.jpg,https://cdn.realtor.ca/listing/TS638628794256670000/reb89/highres/1/R2929701_6.jpg,https://cdn.realtor.ca/listing/TS638628794271070000/reb89/highres/1/R2929701_7.jpg,https://cdn.realtor.ca/listing/TS638628794271030000/reb89/highres/1/R2929701_8.jpg,https://cdn.realtor.ca/listing/TS638628794195670000/reb89/highres/1/R2929701_9.jpg,https://cdn.realtor.ca/listing/TS638628794271070000/reb89/highres/1/R2929701_10.jpg,https://cdn.realtor.ca/listing/TS638628794271070000/reb89/highres/1/R2929701_11.jpg,https://cdn.realtor.ca/listing/TS638628794256630000/reb89/highres/1/R2929701_12.jpg,https://cdn.realtor.ca/listing/TS638628794256630000/reb89/highres/1/R2929701_13.jpg,https://cdn.realtor.ca/listing/TS638628794256600000/reb89/highres/1/R2929701_14.jpg,https://cdn.realtor.ca/listing/TS638628794256630000/reb89/highres/1/R2929701_15.jpg,https://cdn.realtor.ca/listing/TS638628794271030000/reb89/highres/1/R2929701_16.jpg,https://cdn.realtor.ca/listing/TS638628794271070000/reb89/highres/1/R2929701_17.jpg,https://cdn.realtor.ca/listing/TS638628794271070000/reb89/highres/1/R2929701_18.jpg,https://cdn.realtor.ca/listing/TS638628794271370000/reb89/highres/1/R2929701_19.jpg,https://cdn.realtor.ca/listing/TS638628794256630000/reb89/highres/1/R2929701_20.jpg,https://cdn.realtor.ca/listing/TS638628794271030000/reb89/highres/1/R2929701_21.jpg,https://cdn.realtor.ca/listing/TS638628794271030000/reb89/highres/1/R2929701_22.jpg,https://cdn.realtor.ca/listing/TS638628794271070000/reb89/highres/1/R2929701_23.jpg,https://cdn.realtor.ca/listing/TS638628794271070000/reb89/highres/1/R2929701_24.jpg,https://cdn.realtor.ca/listing/TS638628794262100000/reb89/highres/1/R2929701_25.jpg,https://cdn.realtor.ca/listing/TS638628794256670000/reb89/highres/1/R2929701_26.jpg,https://cdn.realtor.ca/listing/TS638628794271330000/reb89/highres/1/R2929701_27.jpg,https://cdn.realtor.ca/listing/TS638628794256630000/reb89/highres/1/R2929701_28.jpg,https://cdn.realtor.ca/listing/TS638628794271070000/reb89/highres/1/R2929701_29.jpg,https://cdn.realtor.ca/listing/TS638628794271100000/reb89/highres/1/R2929701_30.jpg,https://cdn.realtor.ca/listing/TS638628794256600000/reb89/highres/1/R2929701_31.jpg,https://cdn.realtor.ca/listing/TS638628794271200000/reb89/highres/1/R2929701_32.jpg,https://cdn.realtor.ca/listing/TS638628794256630000/reb89/highres/1/R2929701_33.jpg,https://cdn.realtor.ca/listing/TS638628794254570000/reb89/highres/1/R2929701_34.jpg,https://cdn.realtor.ca/listing/TS638628794254600000/reb89/highres/1/R2929701_35.jpg,https://cdn.realtor.ca/listing/TS638628794256630000/reb89/highres/1/R2929701_36.jpg,https://cdn.realtor.ca/listing/TS638628794256670000/reb89/highres/1/R2929701_37.jpg,https://cdn.realtor.ca/listing/TS638628794342930000/reb89/highres/1/R2929701_38.jpg,https://cdn.realtor.ca/listing/TS638628794343170000/reb89/highres/1/R2929701_39.jpg,https://cdn.realtor.ca/listing/TS638628794261100000/reb89/highres/1/R2929701_40.jpg
15,15,34,27553378,"Well maintained 4 bedroom, 3 bath family home on a beautiful tree-lined street in desirable Point Grey. Over 2,600 square feet and sits high on a 50 x 122 foot property with mountain views. Traditional floor plan with newer kitchen, updated bathrooms and a south facing backyard. School Catchment: Queen Elizabeth Elementary and Lord Byng Secondary. (30490106)",3.0,4.0,2792,4530000,Single Family,"4086 W 13TH AVENUE|Vancouver, British Columbia V6R2T4",-123.19661,49.260635,V6R2T4,,,,,,,,,,,,,,,,,,,,,,,,,,,,,,,,,,,,,,,,,,,,,,,,,,,,,,,,
16,16,33,27534873,"Property is strategically located on the south side of the street between Sasamat & Trimble. A prime redevelopment opportunity in the soon to be rejuvenated West Pt Grey Village, with the former Safeway site about to be redeveloped soon. With a frontage of 50.4' x 122' and under the C-2 zoning offers an FSR of a potential max of 2.5... this is an opportunity to redevelop. Currently vacant and no Tenant Improvement on the main level. Upper is current vacant with just 1 residential unit. Rear is a wide open parking area. (35598557)",,,0,4500000,Vacant Land,"4450 W 10TH AVENUE|Vancouver, British Columbia V6R2H9",-123.2076873,49.2636611,V6R2H9,,,,,,,,,,,,,,,,,,,,,,,,,,,,,,,,,,,,,,,,,,,,,,,,,,,,,,,,
17,17,32,27598348,"EExceptionally well-built home with a functional layout, top quality materials & craftsmanship in desirable Point Grey. Excellent location close to schools, public transit, restaurants, beaches, shopping & parks. This beautiful home sits on a 41'X122' lot, boasts almost 3500 sf interior living space, a large sunny backyard & a heated double-car garage. The upper floor has 4 bedrooms including a spacious primary bedroom with a spa-like ensuite, a large walk-in closet & outdoor deck with mountain view; main floor welcomes you with a living, dining, bedroom & a fabulous gourmet kitchen & family room overlooking the tranquil backyard. The lower level includes a  fantastic media & recreation rooms, a guest room, study/hobby room & lots of storage. Comes with AC and radiant heating. School catchment: Lord Byng and Queen Elizabeth. Call now! Open house: 2-4pm, Sunday on November 10. (30538673)",4.0,6.0,3473,4420000,Single Family,"4459 W 12TH AVENUE|Vancouver, British Columbia V6R2R3",-123.207919,49.262202,V6R2R3,27598348,R2940325,"EExceptionally well-built home with a functional layout, top quality materials & craftsmanship in desirable Point Grey. Excellent location close to schools, public transit, restaurants, beaches, shopping & parks. This beautiful home sits on a 41'X122' lot, boasts almost 3500 sf interior living space, a large sunny backyard & a heated double-car garage. The upper floor has 4 bedrooms including a spacious primary bedroom with a spa-like ensuite, a large walk-in closet & outdoor deck with mountain view; main floor welcomes you with a living, dining, bedroom & a fabulous gourmet kitchen & family room overlooking the tranquil backyard. The lower level includes a  fantastic media & recreation rooms, a guest room, study/hobby room & lots of storage. Comes with AC and radiant heating. School catchment: Lord Byng and Queen Elizabeth. Call now! Open house: 2-4pm, Sunday on November 10. (30538673)",House,N/A,2 Level,2009,"(Natural gas), Radiant heat",2009,Garage,2,Freehold,N/A,"$17,868.20","$3,378,000",2012-01-31,https://cdn.realtor.ca/listing/TS638659005534930000/reb89/highres/5/R2940325_1.jpg,https://cdn.realtor.ca/listing/TS638659005534930000/reb89/highres/5/R2940325_2.jpg,https://cdn.realtor.ca/listing/TS638659005534930000/reb89/highres/5/R2940325_3.jpg,https://cdn.realtor.ca/listing/TS638659005534930000/reb89/highres/5/R2940325_4.jpg,https://cdn.realtor.ca/listing/TS638659005534930000/reb89/highres/5/R2940325_5.jpg,https://cdn.realtor.ca/listing/TS638659005534930000/reb89/highres/5/R2940325_6.jpg,https://cdn.realtor.ca/listing/TS638659005534930000/reb89/highres/5/R2940325_7.jpg,https://cdn.realtor.ca/listing/TS638659005534930000/reb89/highres/5/R2940325_8.jpg,https://cdn.realtor.ca/listing/TS638659005534930000/reb89/highres/5/R2940325_9.jpg,https://cdn.realtor.ca/listing/TS638659005534930000/reb89/highres/5/R2940325_10.jpg,https://cdn.realtor.ca/listing/TS638659005534930000/reb89/highres/5/R2940325_11.jpg,https://cdn.realtor.ca/listing/TS638659005534930000/reb89/highres/5/R2940325_12.jpg,https://cdn.realtor.ca/listing/TS638659005534930000/reb89/highres/5/R2940325_13.jpg,https://cdn.realtor.ca/listing/TS638659005534930000/reb89/highres/5/R2940325_14.jpg,https://cdn.realtor.ca/listing/TS638659005534930000/reb89/highres/5/R2940325_15.jpg,https://cdn.realtor.ca/listing/TS638659005534930000/reb89/highres/5/R2940325_16.jpg,https://cdn.realtor.ca/listing/TS638659005534930000/reb89/highres/5/R2940325_17.jpg,https://cdn.realtor.ca/listing/TS638659005534930000/reb89/highres/5/R2940325_18.jpg,https://cdn.realtor.ca/listing/TS638659005534930000/reb89/highres/5/R2940325_19.jpg,https://cdn.realtor.ca/listing/TS638659005534930000/reb89/highres/5/R2940325_20.jpg,https://cdn.realtor.ca/listing/TS638659005534930000/reb89/highres/5/R2940325_21.jpg,https://cdn.realtor.ca/listing/TS638659005534930000/reb89/highres/5/R2940325_22.jpg,https://cdn.realtor.ca/listing/TS638659005534930000/reb89/highres/5/R2940325_23.jpg,https://cdn.realtor.ca/listing/TS638659005534930000/reb89/highres/5/R2940325_24.jpg,https://cdn.realtor.ca/listing/TS638659005534930000/reb89/highres/5/R2940325_25.jpg,https://cdn.realtor.ca/listing/TS638659005534930000/reb89/highres/5/R2940325_26.jpg,https://cdn.realtor.ca/listing/TS638659005534930000/reb89/highres/5/R2940325_27.jpg,https://cdn.realtor.ca/listing/TS638659005534930000/reb89/highres/5/R2940325_28.jpg,https://cdn.realtor.ca/listing/TS638659005534930000/reb89/highres/5/R2940325_29.jpg,https://cdn.realtor.ca/listing/TS638659005534930000/reb89/highres/5/R2940325_30.jpg,https://cdn.realtor.ca/listing/TS638659005534930000/reb89/highres/5/R2940325_31.jpg,https://cdn.realtor.ca/listing/TS638659005534930000/reb89/highres/5/R2940325_32.jpg,https://cdn.realtor.ca/listing/TS638659005534930000/reb89/highres/5/R2940325_33.jpg,https://cdn.realtor.ca/listing/TS638659005534930000/reb89/highres/5/R2940325_34.jpg,https://cdn.realtor.ca/listing/TS638659005534930000/reb89/highres/5/R2940325_35.jpg,https://cdn.realtor.ca/listing/TS638659005534930000/reb89/highres/5/R2940325_36.jpg,https://cdn.realtor.ca/listing/TS638659005534930000/reb89/highres/5/R2940325_37.jpg,https://cdn.realtor.ca/listing/TS638659005534930000/reb89/highres/5/R2940325_38.jpg,https://cdn.realtor.ca/listing/TS638659005534930000/reb89/highres/5/R2940325_39.jpg,https://cdn.realtor.ca/listing/TS638659005534930000/reb89/highres/5/R2940325_40.jpg
18,18,31,27358397,"Luxury in this custom-built home situated in Point Grey area. This 2,886 SF residence sits on a 33 x 123.45 level lot, offering refined details like beautiful millwork, wainscoting, and coffered ceilings on the main floor. The home features a wok kitchen, solid oak hardwood flooring throughout, vaulted ceilings on the second floor, high-end appliances, a wine cooler, a gourmet kitchen, and exquisite cabinetry. Each bedroom comes with an ensuite, and the property is equipped with central air conditioning, HRV, a top-tier security system, central vacuum, gated fence, and a double garage. Additionally, there's a one-bedroom mortgage helper downstairs with a separate entrance. This prime location is near Lord Byng, Queen Elizabeth, St Georges, West Point.Open House Sep 15th,Sun 2 to 4 pm. (30278556)",5.0,4.0,3013,4298000,Single Family,"4474 W 15TH AVENUE|Vancouver, British Columbia V6R3B2",-123.208388,49.259077,V6R3B2,27358397,R2920159,"Luxury in this custom-built home situated in Point Grey area. This 2,886 SF residence sits on a 33 x 123.45 level lot, offering refined details like beautiful millwork, wainscoting, and coffered ceilings on the main floor. The home features a wok kitchen, solid oak hardwood flooring throughout, vaulted ceilings on the second floor, high-end appliances, a wine cooler, a gourmet kitchen, and exquisite cabinetry. Each bedroom comes with an ensuite, and the property is equipped with central air conditioning, HRV, a top-tier security system, central vacuum, gated fence, and a double garage. Additionally, there's a one-bedroom mortgage helper downstairs with a separate entrance. This prime location is near Lord Byng, Queen Elizabeth, St Georges, West Point.Open House Sep 15th,Sun 2 to 4 pm. (30278556)",House,N/A,2 Level,2014,Radiant heat,2014,Garage,2,Freehold,N/A,"$12,500.80","$3,850,000",2023-02-28,https://cdn.realtor.ca/listing/TS638609875948000000/reb89/highres/9/R2920159_1.jpg,https://cdn.realtor.ca/listing/TS638609875870800000/reb89/highres/9/R2920159_2.jpg,https://cdn.realtor.ca/listing/TS638609875870830000/reb89/highres/9/R2920159_3.jpg,https://cdn.realtor.ca/listing/TS638609875870800000/reb89/highres/9/R2920159_4.jpg,https://cdn.realtor.ca/listing/TS638609875918070000/reb89/highres/9/R2920159_5.jpg,https://cdn.realtor.ca/listing/TS638609875864570000/reb89/highres/9/R2920159_6.jpg,https://cdn.realtor.ca/listing/TS638609875864570000/reb89/highres/9/R2920159_7.jpg,https://cdn.realtor.ca/listing/TS638609875864570000/reb89/highres/9/R2920159_8.jpg,https://cdn.realtor.ca/listing/TS638609875948030000/reb89/highres/9/R2920159_9.jpg,https://cdn.realtor.ca/listing/TS638609875948030000/reb89/highres/9/R2920159_10.jpg,https://cdn.realtor.ca/listing/TS638609875864570000/reb89/highres/9/R2920159_11.jpg,https://cdn.realtor.ca/listing/TS638609875949830000/reb89/highres/9/R2920159_12.jpg,https://cdn.realtor.ca/listing/TS638609875904730000/reb89/highres/9/R2920159_13.jpg,https://cdn.realtor.ca/listing/TS638609875870830000/reb89/highres/9/R2920159_14.jpg,https://cdn.realtor.ca/listing/TS638609875864570000/reb89/highres/9/R2920159_15.jpg,https://cdn.realtor.ca/listing/TS638609875948000000/reb89/highres/9/R2920159_16.jpg,https://cdn.realtor.ca/listing/TS638609875949770000/reb89/highres/9/R2920159_17.jpg,https://cdn.realtor.ca/listing/TS638609875864570000/reb89/highres/9/R2920159_18.jpg,https://cdn.realtor.ca/listing/TS638609875864570000/reb89/highres/9/R2920159_19.jpg,https://cdn.realtor.ca/listing/TS638609875864570000/reb89/highres/9/R2920159_20.jpg,https://cdn.realtor.ca/listing/TS638609875948100000/reb89/highres/9/R2920159_21.jpg,https://cdn.realtor.ca/listing/TS638609875919100000/reb89/highres/9/R2920159_22.jpg,https://cdn.realtor.ca/listing/TS638609875909230000/reb89/highres/9/R2920159_23.jpg,https://cdn.realtor.ca/listing/TS638609875850530000/reb89/highres/9/R2920159_24.jpg,https://cdn.realtor.ca/listing/TS638609875909270000/reb89/highres/9/R2920159_25.jpg,https://cdn.realtor.ca/listing/TS638609875909270000/reb89/highres/9/R2920159_26.jpg,https://cdn.realtor.ca/listing/TS638609875915930000/reb89/highres/9/R2920159_27.jpg,https://cdn.realtor.ca/listing/TS638609875949700000/reb89/highres/9/R2920159_28.jpg,https://cdn.realtor.ca/listing/TS638609875850470000/reb89/highres/9/R2920159_29.jpg,https://cdn.realtor.ca/listing/TS638609875956230000/reb89/highres/9/R2920159_30.jpg,https://cdn.realtor.ca/listing/TS638609875909230000/reb89/highres/9/R2920159_31.jpg,https://cdn.realtor.ca/listing/TS638609875850470000/reb89/highres/9/R2920159_32.jpg,https://cdn.realtor.ca/listing/TS638609875850470000/reb89/highres/9/R2920159_33.jpg,https://cdn.realtor.ca/listing/TS638609875909270000/reb89/highres/9/R2920159_34.jpg,https://cdn.realtor.ca/listing/TS638609875950200000/reb89/highres/9/R2920159_35.jpg,https://cdn.realtor.ca/listing/TS638609875956230000/reb89/highres/9/R2920159_36.jpg,https://cdn.realtor.ca/listing/TS638609875943430000/reb89/highres/9/R2920159_37.jpg,https://cdn.realtor.ca/listing/TS638609875967800000/reb89/highres/9/R2920159_38.jpg,https://cdn.realtor.ca/listing/TS638609875943430000/reb89/highres/9/R2920159_39.jpg,https://cdn.realtor.ca/listing/TS638609875954170000/reb89/highres/9/R2920159_40.jpg
